		lágyszárúaknál és fáknál				többnyire lágyszárúaknál			csak fáknál				hasonló növény										
Fekete kökörcsin	Pulsatilla pratensis subsp. nigricans	magányos	összetett	ép	nyeles	6 tagú	lila	hengeres				Tavaszi rétek, sziklagyepek kedves virága, melynek színe és formája egyaránt elbűvölő. Népi nevei - például a tikdöglesztő, mérgező voltára vagy egyéb tulajdonságaira (szőrös tulipán) utalnak.10-25 cm magasságot ér el. Nemcsak szárát, hanem az egész növényt puha, selymes szőr borítja, amely a kora reggeli fagyoktól védi. Szára egyenes, felálló, elágazás mentes. Csúcsán egyetlen, sötét bíborlila, bókoló virág fejlődik, melyet hat lepel alkot (a kétszikűekre egyébként a szirom-és csésze levelek jellemzőek.) A csészék a kökörcsineknél fellevélörvvé módosultak, elegáns prémgallért alkotva, a virág porzói sárgák, számuk sok. Levele szárnyalt. Termése aszmagcsokor, mely a széllel terjed. A repítőkészülék szára dugóhúzószerűen csavarodott, ami akkor egyenesedik ki, amikor nedvesség éri, befúrva a magot a földbe. Mérgező, gyógynövény. Védett, eszmei értéke 5000 forint.											
Fekete lednek	Lathyrus niger	fürt	szárnyalt	ép	nyeles	pillangós	lila	szögletes				A pillangósok gyökerén nitrifikáló baktériumok élnek a növénnyel szimbiózisban, ezek képesek a légköri nitrogén megkötésére. Mezőgazdasági kultúrákba is ültetik őket, takarmánynövényként vagy zöldtrágyának. Erős, szögletes szára nem kúszik, hanem felálló, elágazó. Levelei párosan szárnyaltak, a levélkék tojásdadok, csúcsuk kissé hegyesedő, számuk 8-14. A levél nem kacsban, hanem szálkahegyben végződik. A virágok a levélhónaljakból kinyúló, hosszú kocsányokon nyílnak fürtben. Színük változó, lilától a rózsaszínig, néha egy virágon belül is keverednek a színek, és a vitorlán érdekes, sávos mintázat vehető ki. A virágkocsányok finoman molyhosak. A virágok leszedve megfeketednek, innen kapta nevét. Termése hüvely. Tölgyesek gyakori növénye, májusban virágzik.											
Fekete lonc	Lonicera nigra	magányos	elliptikus	ép	nyeles		fehér		sima	világosbarna	bogyó	Nemcsak kedvelt kerti dísznövények a loncok, a hazai erdőkben is találkozhatunk néhány képviselőjével.  Laza ágrendszerű, kis termetű cserje. Elliptikus-tojásdad, ép szélű, levelei átellenes állásúak, puhák, vékony levéllemezűek, 3-6 cm hosszúak, 1-2 cm szélesek. A kicsi virágok hosszú (1-1,5 cm -es) kocsányon ülnek (ellentétben a hasonló ükörkelonccal), kettesével nyílnak. Színük fehér vagy halványsárga, enyhe rózsaszínes árnyalattal. Termése fényes fekete, borsszemnyi bogyó, ezek szintén kettesével virágoznak. Májusban virágzik, savanyú talajú hegyvidéki erdőkben (nyíres, fenyves). Hazánkban szórványos, védett, eszmei értéke 2000 forint.											
Fekete nadálytő	Symphytum officinale	forgó	lándzsás	ép	lefutó	forrt	lila	szárnyalt				A latin névben szereplő 'officinale' szó arra utal, hogy az orvostudomány is használja. Népies nevei is megemlékeznek erről a tulajdonságáról: forrasztófűnek is nevezik, sebgyógyító hatása miatt. Nagy termetű, akár méteres magasságot is elérhet. Szárát és leveleit sűrű, érdes tapintású szőr borítja. A levelek alakja elég változatos, tojásdadtól a lándzsásig, de szélük minden esetben ép. Tőlevélrózsát alkotó tőlevelei nyelesek, szárlevelei ülők. Virágai harang alakúak, bókolóak, bogernyőben nyílnak. Színük lehet fehér, bíbor vagy rózsaszín, ibolya vagy lilásvörös. Termése makkocska. Említést érdemel még kúszó gyöktörzse is, mely alakja piócára, vagyis nadályra emlékeztet. Nemcsak emberek számára gyógynövény, hanem a biokertek értékes alapanyaga is. Május és június között virágzik nedves talajú, tocsogós réteken, patakok partján.											
Fekete ökörfarkkóró	Verbascum nigrum	fürt	tojásdad	fűrészes	nyeles	5 tagú	sárga	szögletes				Ökörfarkfű, ökörfarkú kóró, farkkóró, borjúfarkafű néven is említik,alakja miatt. A gyapjúfű, molyfű megnevezés szőrös-molyhos levelire utal. A királygyertya nevet valószínűleg szintén a virágzat formája miatt nyerte el. Több, mint egy méteres magasságot is elérhet. Szögletes szára vastag, felálló. Levelei tojásdad vagy hosszúkás alakúak, nyelesek, szélük fűrészes. Virágai élénksárgák, öt tagúak. Porzói lila vagy bíbor színűek, a szirmoktól erősen elütnek, még feltűnőbbé téve a virágot. Dús, szárvégi fürtöt alkotnak,(ez lehet elágazó is) melynek vastagsága egyenletes-emiatt hasonlít ökörfarkra. Toktermése sok apró magot rejt. Száraz rétek, útszélek, erdőszegélyek július és szeptember között virító faja.											
Fekete peszterce	Ballota nigra	örv	tojásdad	fűrészes	nyeles	ajakos	lila	szögletes				Az ajakosak között sok a gyógy-és fűszernövény. A pesztercét idegrendszeri panaszok, köhögés ellen használják fel, de házi alkalmazása körültekintést igényel, mert mérgező vegyületeket is tartalmaz! Elég magasra, akár méteresre is megnőhet. Szára ( mint a család sok tagjának) négyszög keresztmetszetű, dúsan elágazó.. A szárat és a leveleket sűrű szőr borítja. Az ajakosokra jellemző, hogy erős illóanyagokat tartalmaznak- a peszterce illata a penészre emlékeztet. Csipkés-fűrészes szélű levelei rövid nyéllel kapcsolódnak a szárhoz, tojásdadok. Virágai a száron több álörvben nyílnak, közelről megnézve látható rajtuk a szép rajzolat. Alapszínük lila, fehér mintázattal. Termése négy makkocska, de tarackkal is terjed. Június és szeptember között bontja virágait erdőszéli gyomtársulásokban.											
Fekete üröm	Artemisia vulgaris	buga	szárnyalt	ép	nyeles	fészek	sárga	hengeres				Fűszernövényként húsételek kiegészítője, gyógynövényként emésztést javító szer. Kevésbé kellemes tulajdonsága, hogy pollenje allergiát okozhat.  Másfél méteres magasságot is elérő gyomnövény. Erőteljes, merev szára dúsan leveles. A levelek mélyen osztottak, szinte összetettnek látszanak, nagyon hasonlít a parlagfű leveléhez, mely még a nevét is innen kapta: ürömlevelű parlagfű. A levélszeletek szélei épek, csúcsuk hegyes. A levélfonák ezüstös színű. Virágai kicsik, zöldessárga színűek. A fészekvirágzatok tömött bugákban nyílnak. Termése bóbíta nélküli kaszat. Gyomtársulások, szántók, bolygatott területek növénye.											
Felemáslevelű aszat	Cirsium heterophyllum	magányos	hasogatott	ép	ülő	fészek	bíbor	hengeres				Az aszatok nagy része lila-bíborvörös színű virágokkal büszkélkedhet, néhány faj pedig sárgában pompázik.Nevét onnan kapta, hogy levelei nem egyformák. Kifejlett állapotban egy-másfél méter magas, leveles szárú vadvirág. Levelei részben lándzsás alakúak, fogas (vagy nagyon finoman tövises) szélűek, részben hasogatottak, a hasábok keskeny-szálasak. Érdekessége, hogy nincs tüskéje, nem szúr. A nagyméretű, bíborvörös fészkes virágok magányosan nyílnak a szár csúcsán, a fészekpikkelyek lilásak. Termése kaszat. Júliusban virágzik hegyi réteken, erdőszéleken. Hazánkban nem honos.											
Felfutó pirítógyökér	Tamus communis	fürt	szív	ép	nyeles	6 tagú	sárga	hengeres				Mérgező növény, hajtása és fekete, tojásdad, föld alatti gumója egyaránt veszélyes. Hazánkban védett, ritka faj, endemikus (bennszülött faj). Eszmei értéke 2000 forint. Családjának egyetlen hazai képviselője. Kúszó-kapaszkodó. liánszerű szára három méteresre is megnőhet. Fákra, bokrokra kúszik fel, balra csavarodva. A levelek szív alakúak, hegyes csúcsúak, ép szélűek, fényes felületűek. Virág és termés híján is meghatározható a növény a levél jellegzetessége miatt. A sárga virágok karcsú fürtben virágoznak április-májusban. Kétlaki növény, vagyis nem azonos példányon élnek a porzós és termős virágok. Termése fényes, piros bogyó, mely borsószem nagyságú, fürtben terem. Nedves, üde, tápanyagban gazdag talajokon, árnyas erdőkben él.											
Felfutó sövényszulák	Calystegia sepium	magányos	háromszögletes	ép	nyeles	forrt	fehér	hengeres				A szulákot minden kertészkedő ismeri - ártalmatlannak tűnhet, de vékony szárával méteres magasságba is felkapaszkodik a gazdanövényen, és azt a földre nyomja, szinte megfojtja. Mélyre hatoló gyökere miatt lehetetlen száműzni a kertekből. Szára nagyon vékony, nem ágazik el. Alapvetően a földön heverő-kúszó, de a többi növényt támasztékul használva, azokra spirálisan felcsavarodik, így nagy magasságba is eljuthat. Levelei háromszög vagy tojásdad alakúak, nyilas vállúak. A szélük ép, de hullámos. A virágai nagyobbak, mint az apró szuláké, 3-5 cm átmérőjűek, tiszta hófehérek, de ez utóbbihoz hasonlóan tölcsér alakúak. A kertekbe ültetett hajnalka rokona. Termése kerek, kissé csúcsos tok. Nedves termőhelyet kedvel: patakok partján, nádasokban, mocsarak szélén, vizenyős réteken virágzik júliustól szeptemberig.											
Fenyőspárga	Monotropa hypopitys	fürt	pikkely			egyedi*	fehér	hengeres				Szaprofiton, vagyis korhadéklakó faj. Az ilyen növények nem tartalmaznak klorofillt, vagyis zöld színanyagot. Mivel ez nem áll rendelkezésükre, a talajban élő gombák segítségével állítják elő a szükséges tápanyagot. Kis termetű növény, néha szinte észrevétlen marad a talajon, mivel színe sem feltűnő. Szára, levelei és virágai is halványsárgák, viasz szerűek. Szára felálló, halvány pikkelylevelek simulnak rá ( a korhadéklakó fajok levelei mind hasonlóak). Virágai fürtben nyílnak a szár végén, halványsárgák, csak a virágzás és érés előrehaladtával barnulnak meg. A fürt félig bókol. Savanyú talajú lomberdők és fenyvesek faja. Szaprofiton fajokkal olyan redőkben találkozhatunk, amelyeknek talaját kevés fény éri-mint a fenyőerdők vagy a bükkösök.											
Fénytelen galaj	Galium schultesii	bog	szálas	ép	örvös	4 tagú	fehér	szögletes				A galaj fajokra jellemző az örvökben álló levél, a virágaik álernyőben nyílnak. Hazánkban mintegy húsz fajok él, illetve több keverékfaj is. A fénytelen galaj üde erdők típusjelző növénye.30-120 cm-re nő meg, vékony szára inkább heverő. Keskeny, szálas, szinte tűszerű levélkéi szabályos örvökben állnak. Fehér, apró virágai a szár csúcsún álernyőben nyílnak. Termésük úgynevezett petymeg termés. A virágzás ideje május-június.											
Festő csülleng	Isatis tinctoria	buga	lándzsás	ép	szárölelő	4 tagú	sárga	hengeres				Latin és magyar nevében is őrzi színező tulajdonságát. Régen kékfestő növényként termesztették, így vadult ki.Majdnem két méter magas, termetes növény. Hengeres szára dúsan leveles, a levelek lándzsa alakúak, vagy tojásdadok, ép szélűek, füles vállúak, a szárat átölelik. A szár és levél hamvasan szürke. Virágzáskor messziről észrevehető, sárga virágai dús bugákban nyílnak. Termése jellegzetes alakú, lecsüngő becőke: tojásdad, vagy hosszúkás (kicsit hasonlít a kőrisek lependék terméséhez). Áprilistól egészen őszig virágozhat. Sziklagyepek, sztyepprétek, bokorerdők faja. Védett, eszmei értéke 5000 forint.											
Festő pipitér	Anthemis tinctoria	magányos	hasogatott	fűrészes	lefutó	fészek	sárga	hengeres				Régi festőnövény (erre utal latin neve is- tinctora), virágait timsóval pácolták, és ezt használták sárga festék előállítására. Gyógynövény is, gyulladásgátló anyagokat tartalmaz. 20-50 cm magas, elágazó szárú, bokros növekedésű évelő. Levelei fonákjukon gyéren szőrösek, szárnyasan szeldeltek, és minden szeletke hasogatott. A leveleket megdörzsölve érezhető a jellegzetes krizantém illat. Fészkes virágai magányosan ülnek a szár végén. A csöves virágok sötétebbek, mint a nyelves virágok. Utóbbiak néha hiányozhatnak, vagy nagyon rövidek. Termése kaszat. Magyarországon gyakori, bár az Alföldön ritkábban találkozhatunk vele. A szárazságot jól tűri, napsütötte rétek, vágások, lejtők növénye. Június-augusztusban virágzik.											
Festő rekettye	Genista tinctoria	fürt	szálas	ép	ülő	pillangós	sárga	hengeres				Magyar és latin nevében is szerepel a különleges tulajdonságára utaló kifejezés. Régen a gyökérből kivont anyagot kelmék színezésére használták, sárga színű festékanyagot készítettek belőle. A pillangósvirágúak között gyakori a szögletes szár, a rekettyének is ilyen van, ezenkívül fásodó, felálló. Levelei dúsan borítják a szárat, aprók, ülőek, keskeny tojásdadok vagy lándzsa alakúak, szélük és levéllemezük egyaránt ép. A virágok a szár csúcsán nyílnak leveles fürtben. Sárga színűek, keskenyek. Termése a családra jellemző hüvely, mely apró, fekete magokat rejt. Május ás június hónapokban virít réteken, nyílt terülteken, erdei utak szélén. Nemcsak festő, hanem gyógynövény is (vese és epebetegségek ellenszere), de enyhén mérgező!											
Fodros bogáncs	Carduus crispus	magányos	hasogatott	ép	ülő	fészek	bíbor	hengeres				A bogáncsok igen népes nemzetségének tagjai. Ezek a fajok általában olyan helyeken élnek, ahol legeltetés folyik, ezért szúrós tövisekkel védik meg magukat.50-150 cm magas, szára elágazik, szárnyalt. Szárnyasan hasogatott leveleinek fonáka ezüstfehéren molyhos, felszíne fényes zöld. Széle tövises, de a tövisek sokkal kisebbek, mint pl. a bókoló bogáncs esetében, nem szúrósak annyira. Ez a növény élőhelyével van összefüggésben, hiszen ez a faj árnyas, üde erdők, gyomtársulások faja, ahol nem annyira intenzív a legeltetés. A virágai 1-2 cm átmérőjűek, bíborszínűek. A fészekpikkelyek is tövisesek. Termése kaszat.											
Fodros gólyaorr	Geranium phaeum	magányos	osztott	fűrészes	nyeles	5 tagú	bíbor	hengeres				A gólyaorrfélék feltűnő bíbor-lila virágú képviselőjeA Gólyaorrfélék családjának szinte az egész világon vannak képviselői. A családba tartozó kb. 400 fajból Európában 39, Magyarországon 16 található meg. Akár 60 cm nagyságúra is megnövő egyéves növény. Hosszú kocsányon álló magányos virágai bordó – lila színűek,gyakran bólolók. a virágszirmok szétnyíltak. Szára hengeres, levele tenyeresen hasogatott, a a szárhoz nyéllel kapcsolódik, Termése a gólya orrára emlékeztet.											
Foltos árvacsalán	Lamium maculatum	örv	háromszögletes	fűrészes	ülő	ajakos	levendula	szögletes				A Lamium nemzetség az ajakos virágúak közé tartozik. Erre a családra jellemző, hogy majdnem minden tagjának szögletes szára van, illetve erős, illatú, aromás illóolajokat tartalmaznak. Erős, szögletes szárú évelő. Kiterjedt telepeket alkothat. Levelei párosan ülnek a száron, háromszög vagy széles lándzsa alakúak, durván fűrészes szélűek. A szár, levél és összenőtt csészelevelek egyaránt szőrösek, megdörzsölve erős illatot árasztanak. A virágok a levelek hónaljában örvökben nyílnak. 1-2,5 cm nagyok, lilák vagy liláspirosak, a két cimpára osztott ajak halvány színű, sötétebb rajzolattal. A termése makkocska. Április-májusban virágzik, Hazánkban gyakori réteken, utak mentén, erdőkben.											
Foltos hölgymál	Hieracium maculatum	magányos	lándzsás	hullámos	tőálló	fészek	sárga	hengeres				A hölgymál-fajok a fészkesek családjának tagjai. Virágaik sárga vagy narancssárga színűek. A fajok pontos meghatározása általában nagyon nehéz. A foltos hölgymál szerencsére könnyen azonosítható faj. A nemzetségen belül nagy termetűnek számít gyakran 30 cm-es magasságával. Szára vöröses színű, erős szőrökkel borított. Levelei széles lándzsa alakúak, ép szélűek, fodrosak, tőállóak. A leveleket dús szőrzet borítja, ezen kívül szabálytalan alakú, sötétvörös vagy barna foltokkal tarkított. A kerti változatokon ezek a foltok sokkal feltűnőbbek, mint a vadon élő példányokon. Sárga színű fészekvirágzataik magányosak. Termése kaszat. Ritka, kipusztulóban lévő faj! Május végén, júliusban virágzik réteken, nyílt, napsütéses területeken.											
Foltos orbáncfű	Hypericum maculatum	fürt	elliptikus	ép	ülő	5 tagú	sárga	hengeres				A nyolc hazai orbáncfűből három védett faj is található, köztük a pettyes vagy foltos orbáncfű. 15-50 cm magas, a tetején elágazó évelő. Vékony, tojásdad vagy elliptikus levelei ép szélűek, párosával ülnek a száron, a fény felé tartva apró ""lyukak"" láthatóak, hasonlóan a közönséges orbáncfűhöz, de nem pontozott annyira sűrűn. A sárga virágok tömött, lapított fürtben nyílnak. A szirmok, csészelevelek egyaránt lilán pontozottak, erről kapta a nevét. A porzószálak akkorák, mint a sziromlevelek, sok van belőlük. Üde lomb-és fenyőerdők védett növénye, eszmei értéke 5000 forint.											
Foltos ujjaskosbor	Dactylorhiza maculata	fürt	lándzsás	ép	tőálló	kosbor	mikuláspiros	hengeres				Egyre elterjedtebb és kedveltebb növények a szín-és formagazdag trópusi orchideák. A hazai fajok ugyan kisebbek (és mind talajlakók), de ugyanolyan változatosak. 15-50 cm magas kosbor faj. Húsos levelei széles lándzsásak vagy tojásdadok, ép szélűek, vörösbarna foltokkal szabálytalanul tarkítottak. A virágok piros vagy rózsaszín árnyalatúak, néha fehérek, sötétebb rajzolattal. A mézajak az ujjaskosborokra jellemzően kiszélesedő, gyengén háromkaréjú. a középső osztat sokkal kisebb az oldalsóknál. Sarkantyúja lefelé áll. Tortermése van. Láp-és mocsárrétek, üde lomb-és fenyő erdők virága. Védett, eszmei értéke 10 000 forint.											
Forrásmenti madárhúr	Cerastium fontanum subsp. triviale	magányos	lándzsás	ép	ülő	5 tagú	fehér	hengeres				A szegfűfélék családjába sokféle színű és méretű növény tartozik, pl. a színpompás, aránylag nagyvirágú konkoly, vagy a madárhúrok kevésbé feltűnő nemzetsége. Gracilis, 10-30 cm magas növény. A levelei lándzsa alakúak, sötétzöldek, 0,5 cm szélesek, 2-5 cm hosszúak. A virágok magányosan nyílnak az elágazó szár csúcsain. Fehér színűek, az öt szirom mélyen hasadt, szétállóak, a hegyes csúcsú zöld csészelevelek kilátszanak a szirmok között, de rövidebbek azoknál. Az egész növény dúsan, fehéren molyhos. Termése tok. rétek, erdőszélek faja, áprilistól virágzik. /A Cerastium fontanum gyűjtőfaj, több alfaja is van./											
Francia lepkeszeg	Trigonella monspeliaca	fürt	összetett	fűrészes	nyeles	pillangós	sárga	hengeres				Egyes rendszerezők ezt a fajt a lucernafélék nemzetségébe sorolja. Nemzetségének 3 hazai képviselője közül az egyik leggyakoribb. A hazai középhegységek száraz gyepein, illetve az alföld egyes részein fordul elő. Szára általában a földön hever, csak a virágzatban végződő rész áll el a talajtól. Levele hármasan összetett, a levélkék tojásdad alakúak, levélszélük fűrészes. Apró fürtvirágzatát kevés számú sárga virág alkotja. Hosszúkás termése ívesen hajlott.											
Fürtös bodza	Sambucus racemosa	buga	szárnyalt	fűrészes	nyeles		fehér		repedezett	barna	bogyó	A Fekete bodzával ellentétben az 500 méternél magasabban fekvő hegy és dombvidékek meleg területein él, egész Európában őshonos. Az Alpok és Kárpátok területén jóval gyakoribb mint hazánkban. Akár 1400 méterrel a tengerszint felett is találkozhatunk vele. Napsütötte, meleg erdőszéleken és törmeléklejtőkön érzi igazán jól magát. Kérgének színe sötétebb mint a Fekete bodzáé. Virágai lombfakadással egy időben nyílnak. Termése éretten is élénk piros színű, a népi orvoslás is alkalmazta, viszont mérgező anyagokat is tartalmaz. Bár termése az ember számára nem fogyasztható, ennek ellenére nagyon sok madár elsőrendű tápláléka, a növény a gyökérsarjai mellett ezzel is terjeszkedik.											
Fürtös gyöngyike	Muscari racemosum	fürt	szálas	ép	tőálló	forrt	kék	hengeres				A száraz gyepek tavaszi aspektusának jellegzetes lágyszárúja. Gyakori kerti dísznövény. Évelő, hagymás liliomféle. Kedveli a száraz, meleg helyeket. Levelei keskenyek, szálasak, gyakran alig észrevehetők. Szára vékony falú, üreges ritkán nő 20 centiméternél magasabbra. Virágai fürtben állnak, a fürt tetején lévő virágok terméketlenek, az alsó virágoknál halványabb árnyalatúak. Termése sokmagvú tok. Könnyen összetéveszthető az Epergyöngyikével, de ennek virágzata sokkal lazább fürtöt alkot mint a Fürtös gyöngyike. Népi nevén Szent-György virágnak is nevezik. (Szent-György napján virágzik)											
Fürtös homokliliom	Anthericum liliago	fürt	szálas	ép	tőálló	6 tagú	fehér	hengeres				Száraz gyepek nyári ékessége tiszta fehér, csillag alakú virágaival. Régi neve hőlye volt, nevezték ágatlan hőlyének és sáncvirágnak is. Hazánkban védett faj, eszmei értéke 10 000 forint. Viszonylag termetes növény. Szára 30-60 cm hosszú, nem ágazik el. Levelei nagyon keskenyek, szálasak, fűszerűek, a növény töve körül szétterülnek a talajon. Fehér leplű, csinos virágai laza fürtöt alkotnak a szár végén. A sárga bibeszál hajlott, és rövidebb, mint a fehér leplek. Termése rekeszes tok, nem egészen gömbölyű, inkább kicsit megnyúlt. Száraz sziklagyepek, rétek, bokorerdők májusi-júniusi virága.											
Fürtös kőtörőfű	Saxifraga paniculata	bog	lándzsás	fűrészes	tőálló	5 tagú	fehér	hengeres				A kőtörőfüvek rendjébe tipikus sziklai növények tartoznak: varjúhájak, kövirózsák, kőtörőfüvek. Felépítésükkel tökéletesen alkalmazkodtak a sivatagi körülményekhez: pozsgás szárukban vagy levelükben vizet raktároznak, alig párologtatnak.levelek láthatóak. Levél szukkulens. Termése apró tok. Május-júniusban virágzik, napsütötte sziklafalakon, repedésekben. Védett, eszmei értéke 10 000 forint.											
Fürtös salamonpecsét	Polygonatum multiflorum	fürt	tojásdad	ép	ülő	forrt	fehér	hengeres				A salamonpecsétek nevüket a gyökerükön található kerek, pecsét alakú foltokról kapták. Ezek az előző évi szár helyei: a vízszintesen kúszó gyöktörzsön évről évre új hajtás keletkezik, a régi helye pedig így látszik. Régi neve sülyfű ( süly névvel a sok betegséget illettek- skorbut, fekély, daganat, kelés). Hívták farkas csengőfűnek, sokvirágú pecsétfűnek is. Egyenes, elágazó szára nem felálló, hanem oldalra elhajló. Levelei tojásdadok, hegyes csúcsúak. Szárölelőek, a száron párosával állnak, két oldalra kinyúlók. Virágai keskeny harang formájúak, lecsüngőek, a levelek hónaljából 1-6 tagú csomókban lógnak. A fehér, összenőtt leplek csúcsa zöld. Nincs illatuk. Termése hamvas, kékesfekete bogyó, enyhén mérgező. Május-júniusban virágzik üde lomberdőkben ( bükkös, gyertyános tölgyes).											
Fürtös zanót	Cytisus nigricans	fürt	szárnyalt	ép	nyeles	pillangós	sárga	hengeres				Feketéllő zanót néven is ismert (latin nevében is szerepel a nigra-fekete szó), mert leszedett hajtása megszáradva megfeketednek. A zanótok töve általában fás, de még bokor termetű rokonaik is vannak. Merev, fásodó szára dúsan elágazik. Levelei hármasan összetettek, a levélkék széle ép, csúcsuk lekerekített, fordított tojásdadok. Élénk színű, sárga virágai hosszú, elkeskenyedő szárvégi fürtben nyílnak. A virágzatban nincsenek levelek. Télen a virágzat lefagy, a növény fás szára áttelel, majd tavasszal újra kihajt. Termése hüvely. Száraz, kötött, agyagos talajokon, erdei utak, vágások szélén virágzik június-július során.											
Fürtös zörgőfű	Crepis praemorsa	fürt	visszás tojásdad	fogas	ülő	fészek	sárga	hengeres				A fészkesek családjának egyik népes nemzetsége, Hazánkban mintegy 27 fajjal képviseli magát.  Mintegy fél méter magasra megnövő vadvirág. Levelei, melyek tőlevélrózsában állnak, fordított tojásdadok, fogas szélűek. Felálló, hengeres szára csak a csúcsközelben elágazik. A sárga, fészkes virágok laza fürtben nyílnak, a kocsányok sokkal hosszabbak a virágnál. Termése kaszat. május-júniusban virágzik erdei utak szélén, hegyi réteken.											
Füzéres süllőhínár	Myriophyllum spicatum	fürt	szálas	ép	ülő	egyedi*	rózsaszín	hengeres				A gyökerező hínártársulás tagja, vagyis az iszapban gyökerek rögzítik (a lebegő hínártársulást alkotó növényeknél ez nem így van). Kerti tavakban és akváriumokban is használják. Kecses, dúsan leveles, úszó-lebegő hajtásai egy méter hosszúra nőhetnek. Levelei vékony, szálas cimpákra osztottak, finoman tollszerűek. Virágzó hajtásai néhány centiméterre a víz fölé emelkednek, a rózsaszínes vagy pirosas, kicsi virágok fürt vagy füzér virágzatot alkotnak. Lassú folyású, csendes álló és folyóvizek növénye, kozmopolita, vagyis széles elterjedési körű faj.											
