		lágyszárúaknál és fáknál				többnyire lágyszárúaknál			csak fáknál				hasonló növény										
Réti füzény	Lythrum salicaria	füzér	lándzsás	fogas	ülő	6 tagú	bíbor	szögletes				Latin nevében a 'Salicaria' valószínűleg a 'Salix'-ra utal, ami fűzfát jelent-levelei valóban a füzekéhez hasonlók, keskenyek. Gyógynövény, régen gyomor-és bélbetegséget kezelésére használták. Szára négyszögletes, felálló, erős, némileg szőrös vagy molyhos. Levelei ülők, az alsók kettesével-hármasával, a felsők magányosan ülnek. Lándzsás alakúak, szélük ép, csúcsuk hegyes. Virágai tömött füzérben nyílnak a szár csúcsán, feltűnő szépségűek, sötét bíbor rózsaszínek. Termése sok magvú tok. Június-szeptemberben virágzik folyók, patakok mentén, mocsarakban, lápréteken, nedves élőhelyeken.											
Réti imola	Centaurea jacea	magányos	elliptikus	ép	nyeles	fészek	bíbor	szögletes				A Centaurea nemzetségbe imola vagy búzavirág fajok tartoznak. Virágaik sárga, lila, bíbor vagy kék színűek, de a nemes kerti változatok között találunk fehér és rózsaszín példányokat is. Majdnem egy méter magas szára élelt. Alsó levelei tojásdadok, lándzsásak vagy elliptikusak, a felsők lándzsásak vagy elliptikusak. A levél csúcsa tompa vagy alig hegyes. A levéllemez többnyire ép, vagy nagyon gyengén osztott. A levél széle ép vagy finoman fűrészes. Fészekvirágzatai egyesével állnak, bíbor színűek. Csak csöves virágai vannak, a szélsők az imolákra jellemző módon sallangosak. Fészekpikkelyei rojtos szélűek. Termése kaszat. Rétek, szántók, útszélek növénye.											
Réti iszalag	Clematis integrifolia	magányos	lándzsás	ép	átnőtt	4 tagú	lila	hengeres				A legtöbb iszalag faj kúszónövény, de a réti iszalag kivételt képez. Magyarországon védett vadvirág, az eszmei értéke 2000 forint. Felálló szára 20-50 cm magasra nő meg. Levelei a száron keresztbe átellenesen nőnek, tojásdadok, a levélszél és levéllemez egyaránt ép, vége kihegyezett. A szár végén magányosan fejlődik a liláskék, 4-5 tagú, csavarodott szirmú virágok ( ezek valójában elszíneződött csészelevelek). A porzók sárgák. Termése aszmagcsokor, mint az erdei iszalagnak, de jóval rövidebb. Május és szeptember között virágzik nedvesebb, nyirkosabb talajú réteken, legelőkön. Az iszalagok nemesített változatai nagy népszerűségnek örvendenek a kertbarátok között.											
Réti kakukkszegfű	Lychnis flos-cuculi	magányos	szálas	ép	ülő	5 tagú	rózsaszín	hengeres				A buglyos szegfűtől, amely hazánk védett ritkasága, kevésbé szabdalt, sötétebb virágai különböztetik meg. Virágzás idején a nedves réteket rózsaszín virágtengerré változtathatja. 30-70 cm magasra nővő, elágazó szárú szegfűféle. A szár kissé szőrös,vékony, egyenes felálló. Levele kétféle: az alsók lándzsásak, nyelesek, finoman szőrösek lehetnek, a felsők szálasak, ülők, kopaszak. Mindkét levél széle ép, és keresztben átellenes állásúak. Virágai laza bogernyőben virítanak. Halvány rózsaszínek, átmérőjűk 3-4 cm, mélyen (majdnem tövig) hasadtak, négy keskeny sallangra osztottak. Termése 5 foggal nyíló tok, fekete magokkal. Május- július hónapokban találkozhatunk vele nedves réteken, üde erdőkben, mocsarakban, patakparton.											
Réti kakukktorma	Cardamine pratensis	fürt	összetett	ép	ülő	4 tagú	fehér	hengeres				Latin nevében a 'cardamine' szó talán a kardamom nevű fűszerre utal. Említik főzeléknövényként is. Vizes élőhelyen gyakori. Vaskos, üreges szára van. Levelei összetettek, keskeny-szálas, ép szélű szeletkék alkotják, páratlanul szárnyaltnak emiatt tűnik. A levelek ülőek, nyél nélkül kapcsolódnak a szárhoz. A szár felső része lehet enyhén vöröses futtatású. A virágok lapított, szárvégi fürtben nyílnak március és május között. Fehér színűek, néha enyhe lilás színezettel. Négytagúak, mint a család többi tagja is. Termése vékony, keskeny, szálas becő. Vizes réteken, tocsogókban, patakok, tavak partján, belvizes és elárasztott területeken virágzik, tömeges lehet, ilyenkor messziről könnyen észrevehető fehér foltja. Sokszor együtt virágzik a mocsári gólyahírrel.											
Réti kardvirág	Gladiolus imbricatus	forgó	kard	ép	tőálló	6 tagú	bíbor	hengeres				A kardvirág nemesített változatait szinte minden színben megtaláljuk a kertekben, léteznek telt virágú, fodros szélű fajták, mini és óriás méretben. Nagyon jellegzetes, legfeljebb a mocsári kardvirággal összetéveszthető faj (de ennek levelei hegyes csúcsúak, kevesebb virága van és termése tojásdad, tompa csúcsú). A réti kardvirág kard alakú levelei néhány cm szélesek, ép szélűek, az alsó levél csúcsa lekerekített. Virágai jellegzetesek, bíborvörös színűek, füzérnek látszó forgó virágzatban nyílnak, egy oldalra nézve. A virágok száma 3-10. Bár kisebbek a nemesített változatokinál, színük sokkal intenzívebb. Toktermése hegyes csúcsú. Főleg a Zemplén hegyi rétjein él, Hazánk ritka, védett kincse, eszmei értéke 10 000 forint.											
Réti lednek	Lathyrus pratensis	fürt	lándzsás	ép	nyeles	pillangós	sárga	szögletes				Csaknem egész Európában előfordul, a legközönségesebb Magyarországon előforduló lednek faj. Keserű anyagot tartalmaz, ezért a mezőn legelő állatok nem fogyasztják. Gyöktörzses évelő növény. Hazánkban sokfelé előfordul, mezőkön, irtásokon, legelőkön. Szára szögletes, apró a szárhoz simuló szőrökkel borított, vagy teljesen kopasz. Levelei párosan szárnyaltak, csak egy pár található belőlük, lándzsa alakúak és a szárhoz nyéllel kapcsolódnak. Virága sárga színű, a levél hónaljában 3-10-esével nő. Termése a többi lednekéhez hasonlóan hüvelytermés, amely a 3 centiméteres hosszúságot ritkán haladja meg.											
Réti legyezőfű	Filipendula ulmaria	buga	szárnyalt	fűrészes	nyeles	5 tagú	fehér	hengeres				A legyezőfüvek nevüket a virágzat alakjáról kapták, mely egy szétterített legyezőre hasonlít. Magyarországon két faj fordul elő: a koloncos legyezőfű a szárazabb, napsütötte rétek virága, a réti legyezőfű nedvesebb, üdébb réteken virít. Tekintélyes méretű, egy méteresre is megnövő faj. Levelei páratlanul szárnyaltak, több pálhalevélkével, amik jóval kisebbek a részlevélkéktől. Ezek lándzsa alakúak, ráncos felületűek, fűrészes szélűek. A levélpárok nem teljesen egymással szemben helyezkednek el (mint pl. a bükkönyöknél), hanem kicsit mintha el lennének csúszva. Az utolsó levélpár és a csúcslevél össze vannak nőve, mintha egy három karéjú levélben végződne. A kicsi, öt tagú fehér vagy sárgásfehér virágok sátorozó virágzatot alkotnak. Termése hegyes aszmagokból álló kerek aszmagcsokor. A koloncos legyezőfűtől levele és termete alapján tudjuk megkülönböztetni.											
Réti madárhúr	Cerastium fontanum subsp. vulgare	magányos	lándzsás	ép	ülő	5 tagú	fehér	hengeres				A madárhúr nemzetség tagjai a szegfűfélék kevésbé feltűnő képviselői közé tartoznak. A szegfűk egyébként régóta ismert kerti dísznövények. Karcsú termettű, gracilis vadvirág. Hengeres szára elágazó. Lándzsa alakú, sötétzöld, molyhos levelei keresztben átellenes állásúak, ép szélűek. A fehér, öt szirmú virágok magányosak. Az elliptikus-fordított tojásdad szirmok csúcsa mélyen hasadt, ezért tűnhet úgy, mintha tíz szirma lenne. A zöld csészelevelek kilátszanak a szirmok közül. Termése tok. Az egész növény fehéren szőrös. Rétek, útszélek, erdőszélek gyakori virága, tavasztól őszig.											
Réti margitvirág	Chrysanthemum leucanthemum	magányos	lapát	fűrészes	ülő	fészek	fehér	hengeres				A fészkesek családjának talán leismertebb képviselője, amely hazánkban gyakori. Nemesített, nagyvirágú változatait keretekbe ültetik. 20-70 cm magasra nő meg, szára felálló, vörösesbarna árnyalatú lehet. Kétféle levele van: tőlevelei inkább lapát alakúak, nyelesek, szélük fűrészes. Szárlevelei tojásdadok, ülőek, szélük fűrészes. Nagy virágai magányosan állnak a szár végén, 2,5-5 cm átmerőjűek. A csöves virágok élénksárgák (a virágzás előrehaladtával megbarnulnak), a nyelves virágok fehérek. Elvirágzás után a nyelves virágok lehullanak, a csöves virágokból álló vacok kidomborodik. Termése kaszat. Üde és nedves réteken, folyópartokon, erdőszéleken, vágásokban, nyílt hegyi réteken találkozhatunk vele április-augusztus között.											
Réti nyúlhere	Anthyllis vulneraria	fejecske	szárnyalt	ép	nyeles	pillangós	sárga	hengeres				Nyúlszapukának is nevezik. A nemzetség egyes fajtáit takarmánykeverékben ültetik. Mint minden pillangósnak, ennek a fajnak is vannak nitrogéngyűjtő gyökérgümői. Vékony, hengeres szára heverő vagy felemelkedő, fehér szőrrel dúsan borított. Levelei páratlanul szárnyaltak, 7-11 , hosszúkás tojásdad vagy lándzsás, ép szélű levélke alkotja őket. A szárhoz hasonlóan puha, fehér szőrszálak fedik. A száron szórtan helyezkednek el. A virágzat alatt néhány lándzsás, magányos levél gallért alkot. A piros, narancssárga vagy sárga, apró, pillangós virágok szárvégi fürtben nyílnak. A szőrös csészék miatt úgy tűnik, mintha a virágok prémes bundában ülnének. Termése hüvely. Száraz, napos, nyílt réteken, mezőkön virágzik május és június hónapban.											
Réti szegfű	Dianthus deltoides	magányos	szálas	ép	ülő	5 tagú	bíbor	hengeres				Magányos, viszonylag nagy virágai, és a szirmokon látható gyűrű alapján könnyen megkülönböztethető a hasonló fajoktól (barátszegfű, szeplős szegfű). 10-25 cm-es magasságot elérő, elágazó szárú, laza gyepes növekedésű évelő. Levelei különbözők: a tőlevelek szálas-lándzsásak, tompa csúcsúak, szárlevelei szálasak, hegyes csúcsúak, érdes szélűek. Mindkét levél keresztben átellenes állású, szürkészöld. 1-2 cm átmérőjű, bíborvörös virágai magányosan, ritkán kettesével nőnek a szár végén. A szirmok tövén sötét rózsaszín pontok gyűrűt alkotnak, továbbá a szirmon elszórtan fehér pontozás látható. A szirmok széle fűrészes. Csészéjét két, barnás pikkelylevél alkotja, hosszuk a csésze fele. Termése tok. Június-szeptemberben virágzik hegyi réteken, vágásokban, gyepeken. Hazánkban védett, eszmei értéke 5000 forint.											
Réti utifű	Plantago media	füzér	tojásdad	ép	tőálló	redukált	fehér	hengeres				Útilapunak is nevezik. Ha valakinek útilaput kötöttek a talpára, útjára bocsátották. Több jelentése is lehet a kifejezésnek: például felkészítették a hosszú útra, melynek során feltörhetett a lába-amit útifűvel gyógyítottak. Felálló szára egyenes, nem ágazik el, finoman molyhos. Levelei mind tőlevélrózsát alkotnak, a szár levéltelen. Levelei széles tojásdadok, szélük ép, nem tagoltak. Virága aprók, a szár végén füzérben nyílnak, többnyire halvány rózsaszínűek, vagy lilásak. Ennek okai a kilógó porzószálak. A levél alakja alapján megkülönböztethető a lándzsás útifűtől. Ennek virága ráadásul mindig fehér. Termése barna színű ún. csalmatok. Magja apró, fekete. Májustól júliusig virágzik réteken, utak szélén, legelőkön, művelt területek szélén.											
Réti zörgőfű	Crepis biennis	sátorozó	hasogatott	ép	tőálló	fészek	sárga	hengeres				A Crepis nemzetség tagjai igen hasonlítanak egymáshoz. Virágaik sárga színűek. Magyarországon majdnem harminc faj fordul elő. Felálló, elágazó szárú, tőlevélrózsás, egyéves életformájú növény, vagyis egyetlen év alatt hoz hajtást, virágot és termést, majd elpusztul. A tőlevélrózsát alkotó levelek jellegzetesek, hasogatottak (kacúrosak), olyanok, mint a pitypangé. Az alsó szárlevelek ehhez hasonlóak, míg a felsők szálasak. A sárga fészekvirágzatok levegős sátor virágzatban nyílnak egész nyáron át. Termése szőrbóbitás kaszat. Nedves rétek, kaszálók vadvirága.											
Rezes hölgymál	Hieracium aurantiacum	magányos	lándzsás	ép	tőálló	fészek	sárga	hengeres				A hölgymálok nehezen határozhatóak, egymással gyakran hibridizálnak. A rezes hölgymál virágszíne alapján könnyen felismerhető. 15-50 cm magas, tőlevélrózsás évelő. Levelei lándzsás alakúak, ép szélűek, szőrösek. A szárlevelek aprók. A tőkocsány is serteszőrös. A virágok magányosan nyílnak a tőkocsány csúcsán. A nyelves virágok élénk narancssárga színűek. Termése szőrbóbitás kaszat, de legyökeresedő sarjakkal is terjed (csakúgy, mint az ezüstös hölgymál is). Hegyi rétek növénye, nálunk nagyon ritka. Védett, eszmei értéke 10 000 forint.											
Rucaöröm	Salvinia natans		kerekded	ép	ülő							Ugyancsak érdekes megjelenésű növény, melyről nem mindenki gondolná, hogy a harasztok törzsének képviselője, ráadásul a vízi páfrányok közé tartozik. Tápanyagban gazdag, lassú folyású vagy álló vizekben fordul elő, a Tiszán és mellékfolyóin, morotvákban, holtágakban, ahol a víz hamar felmelegszik. A víz felszínén úszik. A levél összetettnek tűnik, ez azonban tulajdonképpen a gyöktörzs, melyek három levélke fejlődik, ebből kettő van a víz színe felett, ezek kerekded, ép szélűek, felületén papillákkal, melyek megakadályozzák, hogy vizes legyen, és elrohadjon. A harmadik levélke módosult, gyökérszerű, a víz alatt található. Virága és termése nincs, spórával szaporodik. Védett faj, eszmei értéke 2000 forint.											
Sajmeggy	Cerasus mahaleb	magányos	kerekded	fűrészes	nyeles		fehér		sima	szürke	csonthéjas	Törökmeggynek is nevezik. Fájából régen pipaszárat készítettek. Termése ehető, kellemes ízű, fűszerként is használják. A madarak is kedvelik. Alacsony (10 m) fa, vagy cserje. Sötétbarna kérge érdes, repedezett. Levelei kerekdedek vagy oválisak, fűrészes szélűek, aprók, 3-5 cm-esek. Csúcsuk kihegyesedő, felületük fényes, fonákjukon szőrösek. A virágai kicsik, fél cm átmérőjűek, fehérek öt tagúak, illatosak. A termése borsszem nagyságú, fényes fekete csonthéjas termés, mely ehető. Száraz, meleg tölgyesek, tisztások, útszélek faja.											
Salátaboglárka	Ficaria verna	magányos	szív	csipkés	nyeles	soktagú	sárga	hengeres				Zsenge, fiatal leveleit tavasszal nyersen lehet fogyasztani, íze a salátalevélére hasonlít, később azonban,a virágzáskor mérgező. Fényes, sárga szirmaival a tavaszi erdők vidám színfoltja. 7-20 cm-es szára nem mindig felálló, inkább kúszó vagy félig heverő. Levelei fényes zöldek, tőállásúak, hosszú nyelűek, kerekdedek, ép vagy csipkés szélűek. Fénylő aranysárga virágai magányosan állnak a szár végén. A virágzás előrehaladtával egyre fakulnak, végül már majdnem fehérek, és fénytelenek. Termése fejecske, melyet aszmagok alkotnak. Üde lomerdők, félárnyékos, nyirkos erdők talaját tavasszal nagy tömegben borítja. Március-május között virágzik. Hazánkban gyakori.											
Saláta galambbegy	Valerianella olitoria	ernyő	lándzsás	fűrészes	ülő	5 tagú	fehér	hengeres				Fiatal, zsenge levelei kellemes ízűek, a kerti saláta ízére emlékeztetnek, és ugyanúgy lehet őket felhasználni. Remek tavaszi vitaminforrás. Téli cikóriának is hívják. Szára vékony, felálló. Leveleinek nagy része tőálló, fordított tojásdad vagy lándzsa alakú, ép vagy enyhén fűrészes szélű, lágy tapintású. A szárlevelek inkább lándzsa alakúak, hegyes csúcsúak, ép vagy fűrészes szélűek, ülőek. A virágok az elágazó száron több ernyőben nyílnak. Fehérek vagy halványkékek, némi zöldes árnyalattal, nem feltűnőek. Öt szirom alkotja őket. Termése kaszat. Március végétől virágzik nedves talajú helyeken, patakok partján, üde erdők szélén, kertekbe is bevándorol.											
Sallangos gólyaorr	Geranium dissectum	magányos	osztott	ép	nyeles	5 tagú	bíbor	hengeres				A gólyaorr és gémorr fajok apró magjaik terjesztésére érdekes és hatékony módszert „dolgoztak ki”: a hosszú toktermés a levegő páratartalmának változására vagy érintésre felpattan és szétlövi a magokat. Szára félig heverő, vékony. Az egész növény borzasan szőrös. Osztott levelei kerekdedek, általában öt részre hasadtak, és a szeletek még további karéjokra oszlanak. Az apró, de élénk színű virágok egyesével vagy kettesével állnak. Termése a gólya csőrére emlékeztető tok. Egész nyáron virágzik nyílt területeken: réteken, mezőgazdasági területeken, utak szélén.											
Sápadt lednek	Lathyrus pallescens	fürt	lándzsás	ép	nyeles	pillangós	sárga	szögletes				Az egyik legritkább lednekfélénk. Hazai állománya erősen megritkult, sok helyen megerősítésre szorul. Biztos állománya található a Mátrai Tájvédelmi körzetben. A hazánkban gyakoribb Magyar lednekkel könnyen összetéveszthető, de míg az utóbbi teljesen kopasz, az előbbi finoman pelyhes, szőrökkel borított. Hazai állománya sok helyen megerősítésre szorul. Biztos állományai a Mátra hegységben találhatóak. Évelő 20 – 40 cm-es magasságot elérő pillangós növény. Levelei párosan szárnyaltak, szálas-lándzsa alakúak. Virágai sápadt sárga, vagy akár fehéressárga színben pompáznak. Termése hüvelytermés. Védett, természetvédelmi értéke: 5000 Ft.											
Sárga árvacsalán	Lamium galeobdolon	fürt	tojásdad	csipkés	nyeles	ajakos	sárga	szögletes				Május június környékén virágzó főleg bükkösökben előforduló évelő növény. Nedves talajú erdőkben, bükkösökben előforduló évelő növény. Akár fél méter magasra is megnőhet, levelei keresztben átellenesek, fűrészes szélűek, a szárhoz nyéllel kapcsolódnak. Május – június között láthatjuk álörvökben álló sárga színű virágait amik a levélhónaljban helyezkednek el. A népi gyógyászat a levelét és a virágát is gyűjti, a belőle készült ülőfürdő vesegyulladás ellen hatásos. Sok gyógyteakeverék alkotórésze.											
Sárga borkóró	Thalictrum flavum	bog	hasogatott	ép	nyeles	egyedi*	sárga	hengeres				Halványsárga, érdekes virágzata miatt feltűnő növény. Hazánkban több borkóró faj él, például a kékes vagy Pannon borkóró, amely védett. 50-120 cm-es, nagy termetű növény. Levelei a száron szórtan helyezkednek el, összetettek többszörösen szárnyaltak, kékeszöld árnyalatúak, a levélkék csúcsa hármasan karéjos. Virága halvány sárgásfehér. Virágzáskor a szirmok lehullanak, a kinyúló porzók miatt a virág olyan, mint egy tollpamacs. Június-augusztusban virít mocsár és lápréteken, vízpartokon. Termése a boglárkafélékre jellemző aszmag.											
Sárga borsócserje	Caragana arborescens	magányos	szárnyalt	ép	nyeles		sárga		sima	barna	hüvely	ína egy részén, Szibériában és Kazahsztánban őshonos cserjefaj. Nevét a borsóéhoz hasonló hüvelyterméséről kapta. Gyorsan növő cserjeféle, végső magassága ritkán haladja meg az 5 métert. Levelei szárnyaltak, a levélkék felülete gyakran szürkén molyhos. Sárga színű pillangós virágai hosszú kocsányokon állnak el a hajtásoktól. Termése ehető. Fájának nincs gazdasági jelentősége, őshonos területein a szél és talajerózió elleni védekezésben használják.											
Sárga fogfű	Odontites lutea	buga	lándzsás	ép	ülő		sárga	hengeres				Latin nevükben is szerepel a fog ( dent) szó. A fogfű nemzetségnem három faja fordul elő Hazánkban. Félélősködő fajok: levelei tartalmaznak zöld színanyagot, képesek a fotoszintézisre, de a vizet és tápanyagokat a gazdanövénytől veszik el. Nevüket arról kapták, hogy a felső szirmok összehajlanak, közülük pedig úgy lóg ki a porzó, mint a fogak a szájból. Vékony, vöröses szára elágazik, levelei keskenyek, lándzsa alakúak, ép szélűek. Sárga színű virágai több , egy oldalra néző füzér alkotta bugában virágoznak. A hosszú, kilógó porzószálak jellegzetesek. Száraz, meleg, nyílt gyepek, rétek, domboldalak növények, nyár végén virágzik.											
Sárga gyűszűvirág	Digitalis grandiflora	fürt	lándzsás	fűrészes	lefutó	forrt	sárga	hengeres				Szívgyógyszer alapanyaga, de házilag nem szabad alkalmazni, mert erősen mérgező. A hosszú fürtben csüngő virágok gyűszűre emlékeztetnek, innen kapták nevüket. 40-100 cm magas évelő. Szára felálló, mirigyszőrös. Levelei szórtan helyezkednek el a száron, lándzsa alakúak, szélük finoman fűrészes. Színükön fényesek, fonákjukon molyhosak lehetnek. Az egész szár leveles, méretük felfelé haladva csökken. Virágai egy oldalra néző fürtben nyílnak, színük sárga, sárgásbarna, 3-5 cm nagyságú. Termése háromrekeszű tok, mely eleinte zöld, éretten világosbarna, sok apró fekete maggal. A toktermésen a bibe maradványa látható. Június-augusztusban találkozhatunk vele tölgyesekben, útbevágásban, suvadásokban.											
Sárga hagyma	Allium flavum	fejecske	szálas	ép	tőálló	6 tagú	sárga	hengeres				Régóta termelt és kedvelt növények a hagymafélék, melyek a liliomfélék közé tartoznak. Vadon élő példányaik gumója sokkal kisebb, de a virágok szín és formagazdagság tekintetében is fölülkerekednek nemes rokonaikon Mintha egy tűzijáték szétrobbanó rakétáját látnánk, ha a sárga hagyma virágára pillantunk: a hosszú kocsányok végén himbálózó apró virágok ezt a hatást keltik. A fejecske virágzatba tömörült virágok a vékony, hengeres szár csúcsún ülnek. Levelei tőállóak, nagyon keskeny szálasak, hegyes végűek, henger alakúak, jellegzetes hagyma illatot árasztanak. Termése apró tok, mely sok magot rejt, de a hagymafélék sarjhagymákkal is szaporodnak, melyek néha a virágzatban találhatók. Száraz gyepeken, sziklalejtőkön, bokorerdők tisztásain virágzik május-június hónapokban. Olykor tömegesen jelenik meg.											
Sárga ibolya	Viola biflora	magányos	szív	fűrészes	nyeles	5 tagú	sárga	hengeres				Az ibolyákat mindenki ismeri, a tavasz kedves, illatos növényei. Néhány faj kivételével gyakori vadvirágok. A sárga ibolya jégkori maradványfaj. Kis termetű, feltűnő virágszíne ellenére elég nehezen vehető észre. Levelei vagy összenyomott szív vagy vese alakúak, fűrészes szélűek, erőteljes erezetűek. A levelek fölé tőkocsányon emelkednek a sárga színű virágok. A kb. 1 cm nagyságú virágokat öt szirom alkotja, ebből négy egyszínű, az ötödik, alsó szirom sötétbarnán csíkozott. Termése öt rekeszű tok. Hazánkban csak egy helyen, a Bükk-hegységben, a Leány-völgyben fordul elő. A képek itt és a Magas-Tátrában készültek.											
Sárga kövirózsa	Jovibarba hirta	bog	lándzsás	fogas	ülő	6 tagú	sárga	hengeres				Gyógynövényként igen érdekes módon használják fel: állítólag a nyers növényből préselt lé a fülbe csepegtetve elmulasztja a fülfájást. Hazánk védett faja, eszmei értéke 2000 forint. Virágtalan állapotban csak gömbölyű tőlevélrózsái láthatóak, melyek borsószem nagyságútól szilva méretűig nőnek meg. A levelek hegyes végűek, finoman fűrészes szélűek. Virágzáskor a növény megnyúló szárán pikkelyszerű levelek láthatóak. Sárga színű virágai a 10-20 cm magas szár végén bogernyőben nyílnak. A virágok harang vagy tölcsér alakúak, a hat szirom széle pillás-rojtos. Apró, leváló sarjnövénykékkel szaporodik. Sziklarepedések, sziklagyepek, kőfalak virága. Június-szeptember között virágzik, de húsos levelű gömbjeit egész évben megtalálhatjuk.											
Sárga len	Linum flavum	sátorozó	lapát	ép	tőálló	5 tagú	sárga	hengeres				Évezredek óta hasznosított növénye a len, amelyet szövetek, kötél, vászon előállítására termesztettek és termesztenek. Hosszas feldolgozás (aratás, szárítás, gubózás, osztályozás, feltárás, áztatás, szárítás, törés, tilolás, gerebenezés) után készül a len A sárga virágú lenfajok kevésbe gyakoriak, mint a kék árnyalatú fajok. Egyik leghíresebb képviselőjük a pilisi vagy pilisszentiváni len (dolomit lennek is hívják), endemikus reliktum faj. A sárga len azonban ennél jóval nagyobb teremtű ( a pilisi len törpecserje), 10-40 cm magas. Levelei szálas lándzsásak, enyhén kékes árnyaltúak (hamvasak), hegyes csúcsúak, ép szélűek. Virágai élénksárgák, a szirmok vége lekerekített. Termése gömbölyű tok. Sziklagyepek, füves lejtők, nyílt rétek virága. Nem ajánlatos csokorba gyűjteni, mert egyrészt védett ( eszmei értéke 5000 forint), másrészt a leszedett len nagyon gyorsan elhullatja szirmait. Június-augusztusban virágzik.											
