		lágyszárúaknál és fáknál				többnyire lágyszárúaknál			csak fáknál				hasonló növény										
Korcshere	Trifolium hybridum	fejecske	összetett	ép	nyeles	pillangós	fehér	hengeres				A herefajok a pillangósvirágúak családjába tartoznak. Legfőbb jellemzőjük, hogy gyökereiken a légköri nitrogén megkötésére alkalmas nitrogéngyűjtő baktériumokkal élnek szimbiózisban, ezért nagyon alkalmasak zöldtrágyának. Első ránézésre könnyen összetéveszthető a fehér herével, de annak szára nem leveles, és nem ágazik el, egy száron csak egy virág nyílik. A korcshere fejecskében nyíló virágai hasonló színűek, fehérek, rózsaszín árnyalattal. Elágazó szárán több, hármasan összetett levél is van. A levélkék tojásdadok, hegyes csúcsúak, halványan sávozottak. A szárhoz nyéllel csatlakoznak, a nyél tövénél hártyás, pirosan csíkozott burok veszi körbe a levélnyelet. Termése apró hüvely. A nevével ellentétben nem több fajta kereszteződésével jött létre, hanem önálló faj. Nedves, vizes rétek június-júliusi virága.											
Kornis tárnics	Gentiana pneumonanthe	magányos	lándzsás	ép	ülő	forrt	kasmírkék	hengeres				Üde hegyi rétek tárnicsféléje. Hazánkban az Északi középhegységtől a Balaton felvidéktől a Soproni középhegységig sokféle területen előfordul szórványosan. Termőhely szempontjából elsősorban hegyi réteket, lápokat, kiszáradó mocsarakat részesíti előnyben. Jellegzetessége, hogy nincsen tőlevele és a virágok általában a hajtás csúcsánál fejlődnek. Az igazán szerencsés erdőjárók akár egész mezőt találhatnak ebből a növényből. Védett, természetvédelmi értéke 10 000 Ft.											
Korongpár	Biscutella laevigata	fürt	lándzsás	ép	tőálló	4 tagú	sárga	hengeres				A keresztesvirágúak családja rengeteg fajt ölel fel, nemcsak vadvirágokat, hanem ismert kerti növényeket ( káposztafélék, torma) is felölel. Vékony szárú, jelentéktelen külsejű növényke. Levelei lapár vagy lándzsa alakúak, az alsó, tőlevélrózsát alkotók fogas szélűek, a kevés szárlevél ép szélű. A sárga, négy sziromból álló virágok szárvégi fürtben nyílnak. A növény legérdekesebb része, melynek alapján könnyű felismerni, a pórosával álló, kerek, lapos becőkék, melyek szemüvegre hasonlítanak ( hívják pápaszemes korongpárnak is). Május végén, júniusban virágzik száraz meleg sziklagyepeken, sziklalejtőkön.											
Köszméte	Ribes uva-crispa	fürt	karéjos	csipkés	nyeles		fehér		sima	szürke	bogyó	Kedvelt kerti gyümölcs, melynek számtalan fajtája létezik, sárga, zöld vagy piros színben. Fogyasztható nyersen, mártásként, befőttként is. Szedés közben azonban nem árt óvatosnak lenni, méretes tövisei miatt. Egy-két méter magas, vékony, sárgás vesszőjű cserje. Levelei kerekded kerületűek, karéjosak, csipkés szélűek, nyelesek. Virágai aprók, jelentéktelenek, csak közelebbről szemlélve tűnik fel szép formájuk, színük. 5 tagúak, forrtak, a szirmok rózsaszín-bíbor árnyalatúak, zölddel kiegészítve. Termése apró bogyó, kb. 0,5 cm nagyok, durván, erőteljesen serteszőrös felületűek. Ehetőek ugyan, de kevésbé ízletesek,mint a kerti fajták. Üde erdőkben, vágásokban, utak szélén találkozhatunk vele. Kertészeti felhasználás Igénytelen, sovány talajokon is jól fejlődik, de a tápanyag utánpótlást bőséges terméssel hálálja meg. Néhány évente ifjítani kell, ilyenkor az idős vesszőket távolítsuk el. Hátránya, hogy fogékony a lisztharmatra.											
Kövér porcsin	Portulaca oleracea	fejecske	visszás tojásdad	ép	nyeles	5 tagú	sárga	hengeres				Gyógynövény- gyulladás-és véralvadásgátló, immunerősítő, érelmeszedést gátló hatóanyagai vannak. Régen főzeléknövényként fogyasztották húsos leveleit, szárát.  A talajról nem emelkedik fel, szétterülve borítja be. Hajtása elágazik, pozsgás növényekhez hasonlít. Levelei rövid nyéllel kapcsolódnak a szárhoz, visszás tojásdad alakúak, csúcsuk lekerekített. Kicsik, alig egy cm hosszúak, vastagok, húsosak. Virágai nagyon aprók, jelentéktelenek, szinte alig lehet őket észrevenni. A hajtás végeken fejecskeszerű virágzatot alkotnak. Kora délelőtt nyílnak. Toktermése több tíz vagy százezer, apró, fekete magot is rejthet. Néha tömegesen jelenik meg és borítja be a kiskertek, szántók közti utakat.											
Kövi pimpó	Potentilla rupestris	ernyő	összetett	fűrészes	nyeles	5 tagú	fehér	hengeres				A pimpó nemzetségnek kevés fehér virágú faja van, sokkal jellemzőbb rájuk a sárga szín, de van néhány kivétel. Fél méteres magasságot is meghaladó növény. Tőlevelei hosszú nyelűek, páratlanul szárnyaltak, 3-5 levélkepár alkotja őket, a csúcsi levélke lényegesen nagyobb. Az 1-1,5 cm méretű, tojásdad vagy kerekded, fűrészes szélű levélpárok között néhány kisebb levélpár is előfordul (félbeszárnyalt). A szárlevelek ülőek vagy rövid nyelűek, hármasan vagy ötösen összetettek. A virágok egyesével vagy laza álernyőben nyílnak, fehérek, öt tompa csúcsú szirom alkotja őket. A csészelevelek hegyesek. Száraz, meleg élőhelyeken fordul elő.											
Közepes rezgőfű	Briza media	füzér	ár	ép	lefutó	redukált	sárga	hengeres				Népiesen Mária könnyének nevezik, a lapított füzérkék alakjáról kapta nevét. Kertekbe is ültethető, szárazvirág csokrokba is kötik ( B. maxima fajt). 20-70 cm magasra, karcsú szárú pázsitfű. Levelei 10-15 cm hosszúak, keskenyek, a szélük ép, illetve kezünket végighúzva kissé érdes. Virágzata többszörösen összetett, a bugákat füzérek alkotják. Ezek a füzéreket, melyről nevét kapta, 5-10 virág alkotja. Május közepétől júniusig virágzik, üde réteken, legelőkön.											
Közönséges aggófű	Senecio vulgaris	bog	hasogatott	fogas	ülő	fészek	sárga	hengeres				Termése miatt pihésfűnek is nevezik. Bár gyógynövény, házi felhasználása nem javasolt, mert mérgező is. Hatóanyagait ipari módon vonják ki. 10-40 magasra megnövő egy vagy kétéves faj. A növény kopasz, vagy finoman molyhos. Szára megtörve fehér színű, keserű tejnedvet ereszt. Levelei hasogatottak, a hasábok széle fogas. Alsó levelei nyelesek, a felsők szárra lefutók. Sárgászöld,henger alakú, csak csöves virágokból álló virágzata bogernyőt alkot. Termése szőrbóbitás kaszat. Március-októberben virágzik gyomtársulásokban, szántókon, olyan talajokon, melyek gazdagok nitrogénben.											
Közönséges aranyeső	Laburnum anagyroides	fürt	összetett	ép	nyeles		sárga		sima	szürke	hüvely	Közép és Dél-Európában őshonos, hazánkban a Dunántúlon vadon is megtalálható. Magashegységei erdők cserjeszintjében érzi otthon magát. Sarjadzóképessége a Fehér akáchoz hasonlóan első osztályú. Levelei ritkásan állnak, páratlanul szárnyaltak és 3 levélkéből állnak. Nevét aranysárga színű, lecsüngő fürtvirágzatáról kapta, a termése csavarodott hüvelytermés. Fája kemény, zöldes árnyalatú, értékes bútoripari alapanyag. Kertészeti felhasználás Szép virágai miatt sokfelé árusítják, gyakran ültetik. Vásárlás előtt vegyük figyelembe, hogy a növény minden része erősen mérgező!											
Közönséges aranyvessző	Solidago virgaurea	buga	lándzsás	ép	ülő	fészek	sárga	hengeres				Gyógynövényként elsősorban különböző vesebetegségek ellen használják. 15- 70 cm magas, gyéren elágazó évelő. Hajtásai dúsan levelesek, a lándzsás alakú levelek ép szélűek vagy hullámosak. Az alsó levelek valamivel szélesebbek a felsőknél, mindegyik ülő. A sárga fészkes virágokat sok csöves és 5-10 (12) nyelves virág alkotja. A virágok dús, tömött fürtös bugákban nyílnak júniustól. Termése kaszat. Üde és száraz erdők, rétek, irtások, erdőszélek gyakori virága.											
Közönséges aszat	Cirsium vulgare	magányos	hasogatott	tövises	ülő	fészek	bíbor	szárnyalt				A bogáncs fajok nagyrészt száraz rétek, legelők növényei. A legelő állatok állandó veszélyt jelentenek rájuk, ezért ezek a növények szúrós tövisekkel védekeznek. Nagy termetű, két méteres magasságot is elérhet, bár inkább 100-150 cm magasra nő meg. Levelei mélyen hasogatottak, szúrós, merev tövisekben végződnek, melyek nagyon szúrósak. A szára szárnyalt, a szárnyacskák is kisebb töviseket ""viselnek"". A virágok nagyok, 2-5 cm-esek, bíborlila csöves virágok alkotják, a fészekpikkelyek szúrósak. Termése szőrbóbitás kaszat. Rétek, legelők, parlagok, útszélek gyakori növénye, mely főleg júliusban virágzik.											
Közönséges bábakalács	Carlina vulgaris	sátorozó	lándzsás	tövises	lefutó	fészek	barna	hengeres				Első ránézésre elszáradt növénynek tűnő virág, amely kaszálók, rétek viszonylag gyakori faja, a legeltetést és taposást is tűri. A bába szó régi jelentése tündér. 30-60 cm magas, egyszerű, vagy felső részén elágazó szárú kétéves vagy évelő növény. A szár végig leveles, barnás-bíboros árnyalatú lehet. Levelei egyszerűek, de a levéllemez tagolt. Alakjuk hosszúkás tojásdad vagy lándzsás. Fodrosak, a szélük fogas, tövisekben végződik, a szárra lefutóak. A fészkeket sárga, lilásbarna és sárgásbarna csöves virágok alkotják, melyeknek átmérője 1,5-3 cm. A virágok sátorban állnak a szár csúcsán. A fehér vagy szalmasárga, fényes fészekpikkelyek látványosabbak, ezek maradnak meg elvirágzás után is. A fészek is szúrós. Július-augusztusban virágzik.											
Közönséges bakfű	Betonica officinalis	füzér	tojásdad	csipkés	ülő	ajakos	bíbor	szögletes				Gyógynövény, mozgás (reuma, köszvény)-és légzőszervi (asztma, köhögés) bajok ellenszere, de régen sebgyógyításra is használták. Elég nagy termetű, szögletes szára majdnem egy méter is lehet. Levelei keskeny tojásdadok, durván fűrészes vagy csipkés szélűek. A virágörvek alatt keskeny murvalevélpár látható. A bíbor színű ajakos virágok örvekben nyílnak, így alkotnak füzér virágzatot. A kevés levelű szár és a murvalevelek igen jellegzetesek. Termése makkocska. A bakfüvet hívják orvosi tisztesfűnek is, említik Stachys officinalis néven is, a gyógyító hatására utalva. Tisztások, hegyi rétek, legelők, gyepek, erdősztyeppek virága, egész nyáron nyílik.											
Közönséges bojtorján	Arctium lappa	fürt	szív	ép	nyeles	fészek	bíbor	hengeres				Gyakori, közismert növény, gyógyhatása miatt gyűjtik is (vizelethajtó, vértisztító, külsőleg is alkalmazzák, pl. gyógysamponokban). 50-150 cm magas, elágazó, fehéren molyhos (néha vöröses) szárú kétéves növény; a szár és virágzat a második évben jelenik meg. Alsó levelei nagyok, szív alakúak, ép vagy gyengén fogas szélűek, a fonákuk fehéren molyhos lehet. A felsőbb szárlevelek inkább tojásdadok, kisebbek is az alsóknál. Virágai leveles fürtben nyílnak. A fészekvirágzata miatt könnyen felismerhető a nemzetség: a horgas végű fészekpikkely csaknem gömb alakot formálnak, ezek között nyílnak a bíbor színű csöves virágok. A horgas fészekpikkelyek segítik a terjedést, és a bojtorján nemzetség adta az ötletet George de Mestralnak, a tépőzár megalkotójának is. Termése szőrbóbitás kaszat. Hazánkban utak szélén, mezőkön, parlagokon, gyomtársulásokban, magaskórósokban gyakori.											
Közönséges borbálafű	Barbarea vulgaris	fürt	hasogatott	ép	szárölelő	4 tagú	sárga	hengeres				A káposztafélék képviselőivel találkozhatunk mezőgazdasági táblákban (repce), kertekben (káposzta), vannak köztük dísznövények (holdviola), fűszernövények (torma) is. 20-120 cm magasra növő, gyakori gyomfaj. Alsó levelei lantosak, a szárlevelek kevésbé tagoltak. A levelek ép szélűek, fényesek, kopaszok. A szárlevelek füles vállúak, szárölelőek. A sárga, négytagú virágok lapított fürtökben nyílnak az elágazó szár csúcsain. Termése 1-3 cm-es becő. Üde rétek, szántóföldek, útszélek vadvirága, nagyon jó mézelő.											
Közönséges boróka	Juniperus communis	toboz	tűlevél	ép	ülő		sárga		lapokban leváló	szürkésbarna	áltoboz	A Borókafélék nemzetségének egyetlen Hazánkban is őshonos képviselője. Régi természetes élőhelyei (ősborókások) ma nagyrészt védettek. Fényigényes, erdei réteken, homokpusztákon is gyakran előforduló cserje. A legeltető állattartás megritkulása nagyban veszélyezteti az élőhelyeit is. Tűlevelei szúrósak, összedörzsölve alma, vagy citrom illatúak. A légzőnyílások a levél hátoldalán magányos sávban helyezkednek el. Egyivarú, egylaki növény. Tobozbogyója két év alatt ér be, az érett bogyókat Gin, borókapálinka és vadhúsok ízesítésére használják fel. Fája szép, bár a bútoripar ritkán alkalmazza, mivel nagyon nehéz hozzájutni az olyan méretes törzsekhez, amelyek alkalmasak ipari felhasználásra. Kertészeti felhasználás Az alapfajt és nemesített változatát is gyakran ültetik. A szennyezett levegőre nagyon érzékeny, ezért városban ritkán láthatjuk.											
Közönséges bükk	Fagus sylvatica	barka	elliptikus	ép	nyeles		sárga		sima	szürke	makk	Egész Európában elterjedt fafaj, erdőgazdasági szempontból hazánk egyik legjelentősebb fafaja. Az északi középhegységben 400-500 méterrel a tengerszint felett alkot összefüggő állományokat, azonban a Nyugat-Dunántúl csapadékosabb klímáján akár 200 méterrel a tengerszint felett is találkozhatunk vele. A hűvös, csapadékban gazdag, kiegyenlített klímát kedveli, érzékeny a kemény telekre, kései fagyokra. Nagyon magas árnyéktűrő képessége miatt a természetszerű erdőgazdálkodás egyik fontos fafaja. Csemetéje árnyalás nélkül el is pusztulhat, a visszamaradó, alászoruló bükkök szépen elélnek az állomány alsó szintjében. Gyökere nem hatol mélyre, éppen ezért a széldöntés elég nagy károkat tud benne okozni. Kérge idős korban is sima, szürke színű. Leveleinek széle általában ép, vagy ritkán fogazott, a levélél pillás. Virága lecsüngő fejecskében nyílik. 8-10 évente hoz bő makktermést. Fája egyszínű, sokoldalúan felhasználható. Rendkívül érzékeny a fülledésre, ezért tárolására nagyon ügyelni kell. A bútorgyártás, és a furnéripar, faszénégetés értékes alapanyaga. Kertészeti felhasználás Elegáns alakja miatt gyakran ültetik parkokba. Többféle kertészeti változata is létezik, amelyek közül a bordó levélszínű vérbükk (Fagus sylvatica „Atropurpurea”) és a lecsüngő ágú „Pendula” a leggyakoribb.											
Közönséges cickafark	Achillea millefolium	sátorozó	lándzsás	ép	ülő	fészek	fehér	szögletes				Jellegzetesen aromás illatú gyógynövény (pl: görcsoldó, gyulladáscsökkentő, vérzéscsillapító). Népi nevei:ezerlevelűfű, pulykafű, cickafarkkóró, egérfarkúfű. 20-60 cm magas, szögletes szárú, gyéren szőrös évelő. Megdörzsölve erős illatot áraszt. Levelei lándzsás kerületűek, 2-4 cm szélesek, 2-3 -szorosan szárnyasan szeldeltek ( innen a latin neve is: mille-ezer, folium-levél). Apró (2-3 mm-es) virágai sátorozó virágzatot alkotnak. Nyelves sugárvirágai fehérek, ritkán rózsasín árnyalatúak ( gyógynövényként csak a fehér virágú fajokat gyűjtik).A fészekpikkelyek barnás árnyalatúak. Sárga porzói a virágzás előrehaladtával megbarnulnak, ettől a virág barnás-piszkosfehérnek tűnik. Termése bóbita nélküli kaszat, de tarackjaival is terjed. Június–októberben virágzik, száraz gyepeken, réteken, utak szélén, parlagokon gyakori.											
Közönséges dercevirág	Cardaminopsis arenosa	sátorozó	hasogatott	ép	nyeles	4 tagú	levendula	hengeres				A káposztafélék vagy keresztesvirágúak családjába sok közismert haszonnövény is tartozik: káposzta, cékla, torma, repce. Kis termetű, kecses növényke. Tőlevelei rozettát alkotnak, hasogatottak, az ülő szárlevelek vagy enyhén hasogatottak, vagy lándzsa alakúak, ép szélűek. A virágzat lapos sátor, a virág négy tagú. Az elliptikus szirmok halványlilák, ritkán szinte fehérek. A termés karcsú becő. Sziklaerdők, szárazabb lomberdők, sziklagyepek virága április-júniusban.											
Közönséges édesgyökerű páfrány	Polypodium vulgare		szárnyalt	ép	nyeles							Magyarországon gyakori, őshonos páfrány-faj. Föld alatti kúszó, elágazó gyöktörzse cukrot is tartalmaz. Tizenöt centi magasra nő meg. Levelei páratlanul szárnyasan összetettek, a levélkék ép szélűek, a csúcslevélke hegyes csúcsú. A levél kerülete lándzsa alakú. A sorus-ok, vagyis spóratartók kerekek, narancssárga színűek, a fonákon párosan találhatóak meg. Nincs sem virága, sem termése ( a virág majd a nyitvatermőknél jelenik meg). Árnyas erdőkben sziklafalakon, sziklarepedésekben él. Gyökere állítólag enyhén édeskés. Bár nem védett, mégse ássuk ki! Az erdőben még sok ehető, finom növénnyel talákozhatunk (pl. málna, szamóca, szeder, húsos som, madárcseresznye), amit meg lehet enni, és még csak nem is jár az egész növény pusztulásával.											
Közönséges fagyal	Ligustrum vulgare	buga	lándzsás	ép	nyeles		fehér		sima	szürkésbarna	bogyó	Egész Európában gyakori lombhullató cserjeféle. A hazai lombhullató erdők és erdőszélek gyakori cserjeféléje. Tavasz végén, nyár elején nyíló, erős illatú bugavirágzatáról könnyen felismerhető. Levelei ép szélűek, gyakran fényes felületűek, hosszúkás tojásdad alakúak. Fényes fekete színű bogyótermését a madarak terjesztik. Enyhébb teleken csak a tavaszi lombfakadáskor hullanak le az előző évi levelei. A növény minden része mérgező, emberi fogyasztásra nem alkalmas. Egyes helyeken vesszős fagyalnak is nevezik. Kertészeti felhasználás A kertészetekben általában szélesebb levelű japán rokonát árulják. Sövény nevelésére mindkét faj alkalmas.											
Közönséges falgyom	Parietaria officinalis	füzér	lándzsás	ép	nyeles	egyedi*	sárga	hengeres				Rom-és bolygatott talajok típusjelző növénye. Sok nedvességre vagy szüksége, és igényli a talaj magas nitrogéntartalmát is. Küllemre hasonlít a csalánra, és ebbe a családba is tartozik. Harminc cm-egy méter magas növény. Levelei széles lándzsás alakúak vagy tojásdadok, nyelesek. Apró virágai tömött füzérekben nyílnak a levelek hónaljában, a szár felső harmadát teljesen beborítják. Toktermése van. Bolygatott, ember által lakott területek, árterek növénye.											
Közönséges füstike	Fumaria schleicheri	fürt	szárnyalt	ép	ülő	egyedi*	bíbor	hengeres				Latin nevében is szerepel a füst (fumar) szó. Latin és magyar nevét egyaránt a virág különleges színe miatt kaphatta. Kis termetű, vékony, törékeny szárú faj. Szára és levele hamvas felületű. A levél mélyen hasadt, sok, keskeny cimpájú levélkékre osztott, melyeknek széle ép. Maga a levél rövid nyéllel kapcsolódik a szárhoz. A halovány, lila vagy vöröses árnyalatú virágok rövid szárvégi fürtben nyílnak ( a fürt rövidebb, és tömöttebb,mint az orvosi füstikéé, 1-2 cm hosszú. A termés gömbölyű makk. Utak mentén, kertekben találkozhatunk vele, áprilistól virágzik.											
Közönséges galaj	Galium mollugo	bog	szálas	ép	örvös	4 tagú	fehér	szögletes				A galajok közös jellemzője az örvös levélállás, álernyős virágzat. Magyarországon húsz faj és több keverékfaj is él. Legtöbbjük gyógynövény is. 25-100 cm magas, szára felemelkedik, négy élű. Levelei örvben állnak, szálasak vagy lándzsásak, szélük érdes. Virágai igen aprók, a szár végén és oldalfürtökben nyílnak, fehér színűek. A virágocskák négy tagúak. Termése, mint a többi galajfajé, „petymeg termés”, mely éretten fekete. Májustól októberig virít üde és félszáraz réteken, erdőkben.											
Közönséges gyíkfű	Prunella vulgaris	füzér	elliptikus	ép	ülő	ajakos	lila	szögletes				Hazánkban három gyíkfű-faj fordul elő. Könnyen elkülöníthetőek egymástól: a fehér gyíkfű virágai alapján, a nagyvirágú gyíkfű pedig mérete miatt. Alacsony termetű, kúszó indákkal terjeszkedő növény. Szára szögletes. Levelei lándzsásak, vagy elliptikusak, szélük lehet ép vagy fűrészes. A száron keresztben átellenesen állnak. A lila színű ajakos virágok rövid szárvégi füzért alkotnak, a csészelevelek barna színűek. Májustól virágzik.											
Közönséges gyújtoványfű	Linaria vulgaris	fürt	lándzsás	ép	ülő	egyedi*	sárga	hengeres				Kiskertekben gyakran találkozhatunk nagyvirágú, színpompás nemesített rokonaival. Az oroszlánszáj vagy tátika régóta kedvelt virág, a gyerekek kedves játéka: a virágot kétoldalt megnyomva szájszerűen kinyílik. Közepes termetű növény. Vékony szára dúsan leveles. Levelei keskenyek, kicsit tűszerűek, ép szélűek, hegyes végűek. Virágai hosszú, szárvégi fürtben nyílnak, élénk citromsárgák, a torkuknál sötétebb, narancssárga folttal, 1-2 cm nagyságúak. A hazai gyújtoványfüvek között találunk fehér és rózsaszín virágú fajokat is. Vékony, hosszú sarkantyúja hátranyúlik. Nemes rokonaival azonos módon, a virág két oldalát összenyomva szája „kinyílik”. A virág megporzása is érdekes módon történik: az alsó ajak a rovar súlyától lehajlik, így fér hozzá a beporzó. Réteken, szántók szélén, utak mentén virágzik július és október között.											
Közönséges ínfű	Ajuga genevensis	fürt	kerekded	ép	ülő	ajakos	kasmírkék	szögletes				Az ínfüvek legyökeresedő indáikkal gyorsan képesek terjedni: a vékony, kúszó szár messzire tud kúszni, ahol az új sarjnövényke gyökeret ereszt. Bár alacsony termetű, mégis könnyen észrevehető faj, feltűnő színű, kasmírkék virágai miatt. Az ajakos virágok szárvégi fürtben nyílnak április-május folyamán. Szára és levelei egyaránt szőrösek, molyhosak. Egyes levelei tőlevélrózsát alkotnak, ez azonban nem mindig látható a virágzás idején. Szárlevelei kerekdedek, az alsók ép lemezűek, a felsők csúcsa kétszer kicsípett, vagyis hármasan karéjos. Erdők, utak szélén, réteken, gyepeken gyakori faj.											
Közönséges japánakác	Sophora japonica	fürt	összetett	ép	nyeles		fehér		barázdált	barna	hüvely	Pagodafának is nevezik, a korona boltozatos alakja miatt. Gyógynövény ugyan, de csak készítmények formájában fogyasztható. 10-25 méteres magaságot elérő, szép alakú, dús koronájú fa. Kérge szürkésbarna, hasonlít a fehér akácéhoz, de sokkal kevésbé durva, repedezett. Levelei párosan szárnyaltak, a levélkék tojásdadok, csúcsuk hegyes, szélük ép, 4-9 pár található egy levélen. A virágok sárgák, enyhe rózsaszín árnyalattal, dús, fürtökből álló bugákban nyílnak, jó méhlegelő. Termése cikkes, zöld hüvely. Kertészeti felhasználás Gyakran ültetik városokba parkokba, sorfának. Virágai és formája is díszít, és jól bírja a légszennyezért. Mivel nagy termetű, kertekbe nem ajánlott.											
Közönséges kakukkfű	Thymus vulgaris	fürt	szálas	ép	ülő	ajakos	lila	hengeres				Régi, népi gyógynövény, kellemes ízű teája remek köhögéscsillapító, a megfázás tüneteit nagyszerűen orvosolja a belőle készült fürdő. Fűszernövényként is felhasználható vadételekhez, húsokhoz, salátákhoz, paradicsomos ételekhez. Bár alacsony termetű,és virágai is aprók, illata már messziről jelzi jelenlétét. A vékony, hengeres szárat sűrűn borítják az ülő, ép szélű, szálas levelek. A szár csúcsán virágoznak az apró, lila, ritkán fehér ajakos virágok dús fürtben. Napfényes időben, mikor az illóolajok erőteljesebben párolognak, több méterről érződik jellegzetes aromája. Ekkor a legérdemesebb gyűjteni, mert hatóanyagainak koncentrációja ilyenkor a legnagyobb. Termése apró makkocska. Április végétől virágzik, sokszor egész nyáron át. Nevét is minden bizonnyal a virágzás kezdetének ideje miatt kapta, hiszen ilyenkor szólal meg az első kakukk. Meleg, napsütötte gyepeken, sziklalejtőkön, réteken, erdőszélen, virágzik. Kirándulások alkalmával érdemes belőle gyűjteni.											
Közönséges keserűgyökér	Picris hieracioides	bog	hasogatott	ép	szárölelő	fészek	sárga	hengeres				A fészkesek családjában gyakori, hogy a növény tejnedvet és keserű-anyagokat tartalmaz (pl. a katáng leveléből nyerik a kávépótló cikóriát). Nagy termetű, elágazó szárú növény. Szára és levelei is szőrösek. Tőlevelei rozettát alkotnak, kacúrosak, szélük durván fogazott vagy ép. Szárlevelei lándzsás alakúak, vagy keskeny tojásdadok, a szélük ép, ülőek vagy félig szárölelőek. A sárga fészkes virágok laza sátorszerű bogernyőben nyílnak. A nyelves virágok csúcsa többszörösen kicsípett. Termése kaszat. Rétek, legelők, szántók, gyomtársulások tagja. Júniustól virágzik.											
