		lágyszárúaknál és fáknál				többnyire lágyszárúaknál			csak fáknál				hasonló növény										
Név	Latin név	virágzat	levél alak	levél szél	levélkapocs	virág alak	virág szín	szár alak	kéreg minta	kéreg szín	termés	Leírás	1	2	3								
Agárkosbor	Orchis morio	fürt	lándzsás	ép	tőálló	kosbor	lila	hengeres				Egyik legkisebb termetű és legkorábban nyíló , viszonylag gyakori orchidea -féle. A talaj mésztartalmára nézve közömbös, hazánkban sokfelé előfordul. 8-20 cm magasra nő meg. Szára felálló, egyenes, zöld színű, csak a virágzatnál bordó-vörös. Alulról felfelé haladva vastagsága számottevően csökken a szárlevelek miatt. Ezek szárölelőek, pikkelyszerűen borítva azt. Tőlevelei 2,5-12 cm hosszúak, közepükön a legszélesebbek, ép szélűek, hegyes csúcsúak, az egyszikűekre jellemzően párhuzamos erezetűek. Virágai 5-25 tagú laza fürtben nyílnak, alulról felfelé. A virágok 1,5 cm körüliek. Lehetnek sötét bíborvörösek, lilák, rózsaszínek, illetve előfordul fehér vagy halványsárga virágú példány is. A gyengén három karéjú mézajak középső hasábja kicsípett, a mézajak sötéten pontozott. A tompa lepellevelek sisakká borulnak össze, amely hosszirányban jellegzetesen zölden csíkozott. Sarkantyúja tompa végű. Április közepétől május végéig találkozhatunk vele kaszálókon, hegyi réteken, homok-és lápréteken, legelőkön, sztyeppréteken Termése sokmagvú tok. Védett, Természetvédelmi értéke: 10 000 Ft.	Tarka kosbor	Vitézkosbor	Bíboros kosbor								
Amerikai kőris	Fraxinus pennsylvanica	buga	szárnyalt	fűrészes	nyeles		bíbor		barázdált	szürkésbarna		Észak-Amerika keleti részéről származik. Hazánkban sok más Amerikából származó fafaj mellett ezt a fajt is az ártereken próbálták meghonosítani. Ma sok helyen kivadult, invazív jellegű. Egyes szakirodalmak Vörös kőrisnek is nevezik. Alakra nagyon hasonlít egy szép növésű Magas kőrishez, viszont rügyei nem fekete hanem barna színűek. Szárnyalt levelei 3 – 9 levélkéből állnak, a levélkék néha karéjosak is lehetnek, szélük általában fogazott, vagy ép. Lependék termése nem csavarodott, világos színű. Fáját hazánkban ritkán hasznosítják ipari célokra. Eredeti élőhelyén fáját gitárok készítésére használják (Az Ibanez, Gibson és Fender gitárok is javarészt ebből a fából készülnek). Gyakori városi parkfa, sok helyen koronáját 2-3 évente visszavágják.	Virágos kőris	Magas kőris									
Apácavirág	Nonea pulla	kunkor	lándzsás	ép	ülő	forrt	bíbor	hengeres				Az érdeslevelűek családjára jellemző, hogy a szárat és levelet sűrű szőr borítja. Termésük általában makkocska. Az apácavirág nemzetségének egyetlen Magyarországi képviselője. 35-40 cm magasra megnövő, felemelkedő szárú növény. Levelei keskeny lándzsa alakúak, szélük és levéllemezük ép. A leveleket és a  szárat az érdeslevelűkre jellemzően finom, fehér szőrök borítják, ettől lesz selymes tapintású az egész növény. Alsó levelei tőrózsát alkotnak, a száron található levelek ülők, szórtan helyezkednek el. Virágai forgóban nyílnak, a forrt párta harangalakú, ezek a levélhónalji kocsányokon nyúlnak ki. A virág színe szokatlan: sötét ibolyaszínűek, majdnem feketék, némelyik barnás árnyalatú lehet.  Termése horgas felületű makkocska.  Ezeknek a horgas szőröknek a növény terjedésében van szerepe, mert ennek segítségével kapaszkodnak az állatok bundájába, akik elhurcolják a magokat. Május- június hónapokban virágzik száraz réteken,kaszálókon, utak mentén.											
Apró füzény	Lythrum tribracteatum	magányos	visszás lándzsás	ép	ülő	6 tagú	rózsaszín	hengeres			tok	A füzény nemzetség legkisebb tajai, földön kúszó hajtásaival és apró virágaival nem nagyon tűnik ki a szikes pusztás növényzetéből. Kicsi termetű növény, hajtásai a földön szétterülnek. Magányos virágai halvány rózsaszínűek, a kicsi szálas vagy visszás lándzsás levélkék hónaljában ülnek. Termése tok. Magyarországon ritka, értékes természeti kincsei a szikes puszták és azok páratlan élővilága. Az apró füzény is ezeken a helyeken fordul elő. Védett faj, eszmei értéke 10000 fortint.											
Apró here	Trifolium dubium	fejecske	összetett	ép	ülő	pillangós	sárga	hengeres				A here-fajok a pillangósvirágúak családjába tartoznak. Fontos tulajdonságuk, hogy a gyökerükön élő nitrifikáló baktériumok segítségével megkötik a légköri nitrogént, így beszántva növelik a talaj nitrogén tartalmát. Alacsony termetű, heverő vagy felemelkedő, elágazó szárú évelő. Levelei hármasan összetettek, nyél nélkül kapcsolódnak a szárhoz. A levélkék tojásdadok vagy fordított tojásdadok, csúcsuk lehet kicsípett vagy végződhet pici szálkában. A szélük finoman fűrészes. A levélerek halványabban látszanak. Finoman molyhosak. A virágok borsószem nagyságú fejecskékben nyílnak, sárga színűek, a vitorla keskeny. Termése összepöndörödött hüvely. Április-június hónapokban virágzik réteken, legelőkön, utak szélén, nyílt területen.	Fehér here	Tartó here	Vajszínű here	Erdei here	Eper here	Hegyi here	Vürüs here	Zörgő here	Mezei here	Bérci here	Korcshere
Apró kankalin	Primula minima	magányos	visszás tojásdad	fűrészes	tőálló	5 tagú	bíbor	hengeres				A magashegységekben élő növények igen szélsőséges körülményekhez kénytelenek alkalmazkodni: nappal forró sziklák, éjjel nagy hideg, kevés csapadék. Ez a havasi növény csupán kettő-öt cm magas. Fényes zöld levelei 1-1,5 cm hosszúak, tőlállóak (kicsi tőlevélrózsát alkotnak), visszás tojásdadok vagy fordított háromszög alakúak. A szélük részben ép, de a kiszélesedő csúcsi részen durván fűrészesek. A virágok magányosan nyílnak a rövidke tőkocsányon. A csésze forrt. Az öt, mélyen kicsípett szirom bíborlila színű, torkukon fehér folttal. A porzók sárga színűek. Toktermése van. májusban virágzik magashegységekben, réteken, sziklák tövében, kiszögelléseken. Hazánkban nem honos, de a Tátrában már találkozhatunk vele.											
Apró keresztfű	Cruciata pedemontana	buga	tojásdad	ép	ülő	4 tagú	sárga	szögletes				<hiányzó leírás>											
Apró kőtörőfű	Saxifraga tridactylites	ernyő	kerekded	ép	tőálló	5 tagú	fehér	hengeres				A kőtörőfüvek száraz, sziklás élőhelyekhez alkalmazkodtak. A család többi tagjai között igazi sziklai túlélőket találunk (többnyire levélszukkulensek). Kis termetű, nehezen észrevehető, jelentéktelen külsejű növényke. Felálló szára cérna vékonyságú, vörös színű, ami igen jellemző faji bélyeg. Levelei mind tőállóak, kerekdedek vagy tőállóak, a szélük ép, némelyiknek a levélcsúcsa kétszer kicsípett, emiatt három cimpájú. A virágok nagyon aprók, fehér színűek, öt keskeny szirom alkotja őket. Hosszú, vékony kocsányon ülnek, mely  a virágnál nagyobb. Néha, mikor tömeges virágzik, olyan, mintha a virágok a levegőben úsznának, mivel a vékony szár alig látszik. A termése tok. Március elejétől virágzik. Sziklafalakon, szirteken, gyepeken, sziklalejtőkön virít.	Fürtös kőtörőfű	Gumós kőtörőfű	Mohaképű kőtörőfű	Pézsmaillatú kőtörőfű							
Apró lucerna	Medicago minima	fürt	összetett	ép	nyeles	pillangós	sárga	hengeres				Magyarországon több lucerna faj is megtalálható. Legismertebb faj a takarmány lucerna. Több védett faja is van.  Meglehetősen kis termetű, szinte alig észrevehető növényke. Szára általában felemelkedik. Levelei hármasan összetettek, a nemzetségre jellemzően a középső levélke levélkenyele hosszabb, mint a két szélsőé. A levélkék tojásdadok, vagy elliptikusak, szélük ép, csak a csúcs enyhén csipkézett. Termése pillás, csavarodott hüvely. Száraz rétek, legelők növénye.											
Apró nefelejcs	Myosotis stricta	forgó	lándzsás	ép	ülő	5 tagú	kék	hengeres				Tavaszi és nyári rétek élénk kék színfoltjai a nefelejcs fajok, de kedvelt kerti virágok is, mivel kevés törődést is hosszú virágpompával hálálnak meg. Kis termetű, gracilis faj. Vékony szára sűrűn szőrös, vöröses futtatású lehet. Szálas vagy lándzsa alakú levelei ép szélűek, ülőek, a szárhoz hasonlóan szőrösek. Virágai világoskékek, igen kicsik, csupán 1-2 mm átmérőjűek. A csészelevelek is szőrösek. Száraz gyepek, rétek, útszélek tavasz végi virága.	Parlagi nefelejcs										
Apró szulák	Convolvulus arvensis	magányos	lándzsás	ép	nyeles	forrt	fehér	hengeres				Említik homeopátiás szerként, hátfájás csillapítására, de napjainkban nem használják. Ártalmatlannak tűnhet, de erős, csavarodó szárával agresszívan terjed. A földről alig emelkedik fel, de vékony, csavarodott szárával több méterre is képes elkúszni, vagy felmászni, a gazdanövényt, kerítést kapaszkodónak használva. Levelei nyíl alakúak, szíves vállúak. Virágai fehérek vagy rózsaszínek, sötétebb csíkokkal, tölcsér alakúak. Termése tok. Igen szárazságtűrő, gyökere több méterre is lehatolhat, hogy elérje a talajvizet. Június-szeptember között virágzik, szántókon, művelt területen. Nagy számú magja, kiváló reprodukciós képessége miatt nagyon gyorsan el tud terjedni.											
Arany pimpó	Potentilla aurea	magányos	összetett	fűrészes	nyeles	5 tagú	sárga	hengeres				A pimpók többnyire sárga virágúak, bár néhány faj fehérben pompázik. Több hazai faj is védett. Az arany pimpóval sajnos nem találkozhatunk itthon. Heverő-kúszó szárú faj. Levelei ötösen összetettek, a fordított tojásdad levélkék széle fűrészes. A kevés szárlevél hármasan összetett, ülő. Az élénksárga szirmok csúcsa kicsípett, a szirmok tövén jellegzetes, feltűnő narancssárga folt látható. Tíz hegyes csészelevele van. A levelek és szár finoman molyhos. Alhavasi övben fordul elő, törpefenyvesek szélén, réteken. Május végén virágzik. A szirmokon látható narancs színű minta egyes naprózsa fajoknál is jelen van.	Indás pimpó	Vörösszárú pimpó	Homoki pimpó	Ezüst pimpó	Kövi pimpó	Libapimpó	Henye pimpó	Egyenes pimpó	Vérontófű		
Aranyveselke	Chrysosplenium alternifolium	bog	kerekded	csipkés	lefutó	4 tagú	sárga	háromélű				Magyar elnevezését a virág sárga színe és a levelek vese alakja miatt kapta. Három élű szára alig arasznyira emelkedik fel a földről. Alsó, nyeles tőlevelei kerekek, csipkés szélűek. A felső szárlevelek, amit első pillantásra a virágzat részének lehet hinni, vese alakúak, szintén csipkés szélűek, ülőek, halványak, majdnem sárgás zöldek. Ezek közt a levelek közt ülnek az apró,négytagú sárgászöld virágok. Valójában nem igazán feltűnőek, néha csak az utolsó pillanatban lehet őket észrevenni. Gyors vizű hegyi patakok partján virágzik kora tavasszal, március közepétől már ott aranylik az avar között.											
Aranyvessző	Forsythia x intermedia	magányos	tojásdad	fűrészes	nyeles		sárga		sima	barna		Aranyfának is nevezik, mert virágzáskor úgy ellepik a sárga virágok a hajtásokat, hogy ki sem látszanak. Általában aranyesőnek szokták hívni, pedig nem ugyanaz a két faj: az aranyeső, a Laburnum anagyroides, a pillangósvirágúak közé tartozik, lecsüngő fürt virágzata a lombfakadás után nyílik, alacsony termetű fa. Az aranyvessző, a Forsythia még lomfakadás előtt virágzik, és bár sűrű fürtnek tűnik, virágai mégis egyesével nyílnak. Viszont mindkét faj mérgező! Az aranyvessző 3-5 méter magas cserje, vékony vesszői elhajlóak. A fiatal vesszők kérge majdnem sárga vagy zöldes, enyhén szemölcsös. Tojásdad vagy széles lándzsa alakú levelei fűrészes szélűek, átellenes állásúak. A sárga, négy tagú, tölcsérszerű virágok áprilisban nyílnak tömegesen. Termése tok. A forsythia jellegzetes, gyakran ültetett díszcserjénk											
Aszúszegfű	Petrorhagia prolifera	magányos	szálas	ép	ülő	5 tagú	lila	hengeres				Napsütötte réteken, sziklagyepeken találkozhatunk a szegfűfélék eme képviselőjével. A család tagjainak jellegzetes morfológiai vonása a keresztben átellenes, többnyire keskeny, szálas levél. Körülbelül 15-30 cm magasra nő meg. Felálló szára egyenes, hengeres, merev-így alkalmazkodva a csapadékszegény, meleg élőhelyekhez. Levelei keskeny-szálasak, keresztben átellenes állásúak, szárra lefutók. A levelek kapcsolódásánál  a szár csomószerűen megvastagodott.  Állcsészelevelei sárgásbarnák, hártyásak, ebből lógnak ki az apró, pár mm-es virágok. A szirmok halvány rózsaszínűek. Termése tok, amely sok apró, fekete magot rejt. Nyár végén virágzik, száraz, meleg, sekély termőrétegű élőhelyeken.											
Atlasz cédrus	Cedrus atlantica	toboz	tűlevél	ép	ülő		barna		pikkelyes	szürkésbarna	toboz	Természetes előfordulási helye Algéria és Marokkó. Magyarországon nem alkot egybefüggő állományokat, elsősorban parkok, kertek, arborétumok díszfája. Eredeti élőhelyén közép- és magashegységek hűvösebb lejtőin fordul elő. Magyarországon természetben nem nagyon találkozhatunk vele, inkább parkokban látható. Törzse egyenes, kérge szürkésbarna, pikkelyesen repedezett, érdes. Ágai szétterülnek, főleg idős korban már lapított a korona. Tűi örökzöldek, nem hullanak le, hamvas szürkés-kék színűek, csoportosan állnak, akár a vörösfenyőé. Toboza tömzsi, hordó alakú, kinyílva lapos, olyan mint egy virágzó rózsa. Két év alatt fejlődnek ki. Faipari alapanyagként nem terjedt el, inkább esztétikai szerepe van.											
Avarvirág	Goodyera repens	füzér	tojásdad	ép	tőálló	kosbor	fehér	hengeres				Mészkerülő fenyvesek ritka, apró teremtű kosborféléje. Magyarországon a Vendvidéken, az Őrségben és a Hetés határvidékén találkozhatunk vele. Szára a földön kúszva elágazik, telepet alkotva. Mindössze 10- 25 cm-re nő meg, így nem könnyű észrevenni az árnyas erdőtalajon. Szára finoman mirigyszőrös, alul kopasz. Levelei tőállóak, tojásdadok, ép szélűek, hegyes csúcsúak, sötétzöldek, fényesek. Színükön jellegzetes hálózatos (kígyóbőrszerű) minta látható. Csak a következő év tavaszán pusztulnak el. Virágai 5-15 tagú fürtben állnak (aprók, mindössze 4-5 mm méretűek), fehérek, vagy sárgásfehérek. Nem alkotnak tökéletes spirált, mint a füzértekercs. A szárhoz hasonlóan pelyhesek. A mézajak rövid, ép, töve kiöblösödő. Termése hatrekeszű tok, amely rengeteg apró, lisztfinomságú magot rejt. Július-augusztusban nyílik.											
Ágas békabuzogány	Sparganium erectum	fejecske	kard	ép	tőálló	egyedi*	fehér	hengeres				Hazánkban három békabuzogány faj él. Nevüket jellegzetes alakú terméscsoportjukról kapták, a béka előtag pedig minden bizonnyal élőhelyükre (lassú folyású patakok, tópartok) utal. Nagy termetű növény, akár másfél méteres magasságot is elérhet. Kúszó gyöktörzse van. Fényes sötétzöld levelei kard alakúak, hajlékonyak, ép szélűek. Vaskos szára hengeres. Kicsi virágai tömött fejecskében nyílnak, fehér színűek. Több fejecske alkotja a füzér virágzatot. Jellegzetes alakja miatt már ekkor feltűnő jelenség. Termései zöld színűek, tömött fejecskébe rendeződnek, egyenként hegyes csúcsúak, emiatt lesz a terméscsoport érdes, felületű, mint a buzogány feje. Magyarországon viszonylag gyakori.											
Ágas homokliliom	Anthericum ramosum	buga	szálas	ép	tőálló	6 tagú	fehér	hengeres				Karcsú szárával, apró fehér virágával néha szinte észrevehetetlen. A törékenynek tűnő növény igen mostoha körülményeket is elvisel, találkozhatunk vele sziklagyepeken, kőomlások sziklái között is. Nagyon vékony, elágazó szára 30-60 cm-es magasságot ér el. Száránál rövidebb, szálas keskeny levelei tőállóak. Néha a száraz fűben meg sem lehet különböztetni őket környezetüktől. A fehér, hat tagú virágok laza bugában nyílnak. A sárga színű bibe egyenes, és hosszabb a lepleknél. Termése gömbölyded, rekeszes tok, de gyökerével is terjed. Száraz gyepek, rétek, hegyi kaszálok, kőomlások, nyíltabb erdők virágai, mely június-augusztusban nyílik.	Fürtös homokililiom										
Árlevelű len	Linum tenuifolium	sátorozó	szálas	ép	ülő	5 tagú	fehér	hengeres				A termesztett lenfajok 80-120 cm magasra nőnek meg. A vadon élő fajok alacsonyabbak,az árlevelű len 30-50 cm-re nő meg. Az egész növény kopasz, szára vékony elágazó. Levelei aprók, szálasak, ép szélűek, a száron szórtan állnak. Virágai fehérek vagy halványlila árnyalatúak, a szirmok erezete egy kicsit erősebb, mint az alapszín. Termése gömbölyű tok.  A lenféléket nem érdemes csokorba szedni, egyrészt mert védett fajok is vannak köztük (mint az árlevelű is, eszmei értéke 5000 forint), másrészt igen hamar lehullanak a törékeny szirmok. Május-június hónapokban virágzik, nyílt réteken, parlagon maradt földeken, szántókon találkozhatunk vele.											
Árnika	Arnica montana	magányos	elliptikus	ép	tőálló	fészek	sárga	hengeres				Régóta használt gyógynövény az árnika, melyet külsőleg sebek gyógyítására, gyulladások csökkentésére használnak, a körömvirághoz hasonlóan. Jellegzetes faj, és bár a fészkesek családjában gyakori a sárga szín, mégis könnyű felismerni. Fél méteresre is megnőhet. Tőlevelei rozettát alkotnak, szárlevelei keresztben átellenesek. A levelek lándzsásak vagy elliptikusak, kicsit pozsgás tapintásúak. Virágai egyesével (esetleg másodmagukkal) nyílnak a tőkocsány csúcsán. Csöves virágai sárgák, a nyelves virágok barnásak, hosszúak, keskenyek, a virág átmérője 4-6 cm. Termése kaszat. Magyarországról eredeti élőhelyeiről (hegyi rétek, gyepek) kihalt, az Őrségben él telepített állománya. Eszmei értéke 10 000 forint. Az árnika gyógynövény, Hazánkból kihalt											
Árpa	Hordeum vulgare	füzér	szálas	ép	ülő	redukált		szalmaszár				A hidegebb éghajlatú országok máig legfontosabb és egyben a legkorábbról ismert gabonanövénye. Nemzetségének 30 képviselője van. Karrierjét a gazdálkodással még éppen csak próbálkozó emberrel kezdte, és meg is maradt, a civilizáció egyik legfontosabb gabonanövényének. Mivel a sörfőzés egyik legfontosabb alapanyaga is egyben, így minden valószínűség szerint ezt a növényt egy jó darabig nem fogja fenyegetni a kihalás veszélye. Mint már említettem, nemzetségének 30 képviselője van, így természetesen akad köztük egyszerű gyom, illetve gazdasági haszonnövény is. Jelen faj alatt a gazdaságilag jelentős egyedeket tárgyaljuk. Mint minden ilyen növényt, ezt is többféle módszer szerint nemesítették, így egy formagazdag, változatos csoportot hoztak létre, melyek egyedeit általában a .convar -szóval jelölnek. Ezek lehetnek 2-soros (ebből készül a whisky illetve a sör), 4-soros (jellegzetessége, hogy nagyon korán betakarítható, és elég gyatra talajokon is termőképes) valamint a 6-soros, amely abban különbözik a többitől, hogy a kalászorsó padkáin 3-masával ülnek a magvak. A magvakat sokféle-képpen hasznosítják, a pörkölt árpából készíthetünk pl. koffeinmentes kávét :)											
Bablevelű varjúháj	Sedum maximum	bog	tojásdad	fűrészes	ülő	5 tagú	sárga	hengeres				A család tagja remekül alkalmazkodtak mostoha élőhelyeik körülményeihez. Húsos leveleikben nedvességet raktároznak, a sziklarepedésekben összegyűlt kevéske földben is képesek megkapaszkodni. A bablevelű varjúháj levele eltér a többi fajétól: nem apró, hengeres, hanem lapos,fordított tojásdad, 1-3 cm hosszú és 1-1,5 cm széles. Szélük fűrészes, a száron párosával helyezkednek el. Bár alakja eltérő, abban hasonlít rokonaihoz, hogy vastag, húsos. Szára felálló, vörössel futtatott. Virágai kicsik, sárgás fehérek, a szár végén bogernyőt alkotnak. A virágocskák öttagúak, a hegyes végű szirmok miatt csillag formára hasonlítanak. Termése tüszőcsokor. Sziklaomlásokon, sziklafalakon, sziklás bokorerdőkben virágzik június és szeptember között.											
Bajuszos hagyma	Allium vineale	ernyő	szálas	ép	tőálló	6 tagú	bíbor	hengeres			tok	Különös megjelenésű faj, gömb alakú virágzatát apró virágain kívül rengeteg apró sarjhagyma alkotja. A sarjak közül kilógnak a porzószálak karakteresek. Szára vékony, hengeres. Kékeszöld levelei vékonyak, szálasak, kopaszak, félkör keresztmetszetűek, tőállóak a virágzás idejére elszáradnak. Gömb alakú virágzata a szár végén ül, kevés rózsaszín virág és sarjhagymák alkotják, de előfordulhat, hogy a virágok hiányoznak. Termése kicsi tok. Az egész növény erős fokhagyma illatot áraszt. Június-augusztusban virágzik száraz gyepeken, szántókon, szőlőkben.											
Bakszakáll	Tragopogon pratensis	magányos	lándzsás	ép	lefutó	fészek	sárga	hengeres				Régi nevei zabgyökér vagy kecskedísz. A fészkesek egy külön nemzetsége. Fiatal gyökerét és levelét régen gyűjtötték és fogyasztották is. 30-80 cm magasra növő faj. Szára felálló,hengeres, gyéren barázdált. Levelei szórtan helyezkednek el, keskeny lándzsásak, félig szárölelők, ép szelűek, fodrosak is lehetnek. Megtörve fehér tejnedvet ereszt. Virágai magányosan nyílnak az enyhén elágazó száron. 3-7 cm átmérőjű virágai sárgák, a fészek pikkelyek valamivel hosszabbak a nyelves virágoknál. A kora hajnali órákban nyílnak, és ahogy feljön a Nap, becsukódnak. Szőrkoronás kaszat termései 3-6 cm átmérőjű gömbben állnak, a magok 15-20 mm nagyok. Június júliusban virít, üde és száraz réteken, utak szélén, kaszálókon gyakori.											
Bálványfa	Alianthus altissima	buga	szárnyalt	ép	nyeles	5 tagú	fehér		sima	barna	lependék	Gyakran nevezik ecetfának, pedig e két faj nem ugyanaz! Az ecetfa latin neve Rhus typhina, és bár levele némileg hasonlít a bálványfáéra, nem is egy családba tartoznak. Gyorsan, nagy méretet érhet el. Egy év alatt képes akár egy méternél is nagyobb hajtásokat hozni (fiatal korban). Levelei párosan vagy páratlanul szárnyalt, 10(11)-26(27) lándzsás alakú levélke alkotja. A levélkék széle ép, eltekintve a levélke alsó részén látható fülecskétől, mely jellegzetes (az alapján egyértelműen el lehet különíteni a fekete diótól, melynek hasonlóképpen lehet párosan szárnyalt a levele). A levélnyél egy méter hosszú is lehet. Sárga vagy halvány rózsaszínes virágaik nagy bugákban nyílnak júniusban. Termése a kőrisekéhez hasonló szárnyas lependék, de a mag középen helyezkedik el. Nagyszámú magjával és sarjakkal gyorsan terjed, szinte bárhol megveti gyökerét. Kérge barna, sima, idősebb korba hosszanti, fehér repedésekkel. Hajtásai vastagok, fényesek, selymesen szőrösek, a levélripacsok (előző évi levélalap helye) nagyok, a rügyek aprók.											
Baracklevelű harangvirág	Campanula persicifolia	fürt	lándzsás	ép	nyeles	forrt	levendula	hengeres				Útszélek, lomberdők akár 1 méteres magasságot is elérő harangvirágféléje. Akár a 100 cm-es nagyságot is elérő évelő harangvirágféle (Campanulaceae). Levele lándzsa alakú, ép szélű a szárhoz nyéllel kapcsolódik. Magyarországon és általában a kontinentális éghajlatú területeken gyakori, lomberdőkben, útszéleken találkozhatunk vele. Melegkedvelő. Kevés virága laza fürtöt alkot, a virágszín lila. Termése a többi harangvirágéhoz hasonlóan toktermés, mely a termés alján található három lyukkal nyílik.											
Baracklevelű keserűfű	Polygonum persicaria	füzér	lándzsás	ép	nyeles	egyedi*	rózsaszín	hengeres				Nevét az őszibarack latin nevéből (Prunus persica) nyerte, a levél alakja miatt. Bizonyos eljárással sárga festékanyag is nyerhető belőle. Régen a népi gyógyászat több célra is felhasználta, és nyersen fogyasztották is. Vékony, elágazó szára felálló vagy heverő, zöld színű, néha vöröses árnyalattal. Lándzsa alakú leveleinek széle ép, ülők vagy rövid nyéllel kapcsolódnak a szárhoz. Színükön néha sötéten foltosak. A szár csúcsán sokvirágú álfüzérben nyílnak az apró, fehér vagy halványrózsaszín virágok. A virágzatot tartó kocsányos a levelek hónaljából nyúlnak ki. Termése fekete fénylő makk, mely igen apró. Július és október között nyílik parlagokon, szántóföldeken, patakok partján, ahol nedves a talaj.	Kígyógyökér keserűfű	Borsos keserűfű	Madárkeserűfű								
